/users/PAS2099/mino/miniconda3/envs/ICICLE/lib/python3.11/site-packages/timm/models/layers/__init__.py:48: FutureWarning: Importing from timm.models.layers is deprecated, please import via timm.layers
  warnings.warn(f"Importing from {__name__} is deprecated, please import via timm.layers", FutureWarning)
2025-07-12 15:57:33,740 - root - INFO - Saving to /fs/scratch/PAS2099/mino/ICICLE/log_auto/pipeline/serengeti_serengeti_M10/zs/2025-07-12-15-57-29/bioclip2/full_text_head/2025-07-12-15-57-33/log. 
wandb: Currently logged in as: minodaze (minodaze-the-ohio-state-university) to https://api.wandb.ai. Use `wandb login --relogin` to force relogin
wandb: Tracking run with wandb version 0.20.1
wandb: Run data is saved locally in /users/PAS2099/mino/ICICLE/wandb/run-20250712_155733-14hrywu0
wandb: Run `wandb offline` to turn off syncing.
wandb: Syncing run serengeti_serengeti_M10 | zs | 2025-07-12-15-57-29 | bioclip2 | full_text_head | 2025-07-12-15-57-33
wandb: ⭐️ View project at https://wandb.ai/minodaze-the-ohio-state-university/ICICLE-Benchmark
wandb: 🚀 View run at https://wandb.ai/minodaze-the-ohio-state-university/ICICLE-Benchmark/runs/14hrywu0
2025-07-12 15:57:34,648 - root - INFO - wandb logging is enabled.
2025-07-12 15:57:34,649 - root - INFO - {'accu_eval': False,
 'adapter_bottleneck': 64,
 'adapter_init': 'lora_kaiming',
 'adapter_scaler': 0.1,
 'al_config': {'method': 'none'},
 'attention_index': None,
 'attention_type': 'full',
 'bitfit': False,
 'block_index': None,
 'c': '/fs/scratch/PAS2099/mino/ICICLE/configs/generated_common/serengeti_serengeti_M10_upper_bound.yaml',
 'cl_config': {'method': 'none'},
 'common_config': {'model': 'bioclip2', 'train_data_config_path': '/fs/scratch/PAS2099/camera-trap-benchmark/serengeti/serengeti_M10/30/train.json', 'eval_data_config_path': '/fs/scratch/PAS2099/camera-trap-benchmark/serengeti/serengeti_M10/30/test.json', 'all_data_config_path': '/fs/scratch/PAS2099/camera-trap-benchmark/serengeti/serengeti_M10/30/train-all.json', 'train_batch_size': 32, 'eval_batch_size': 512, 'optimizer_name': 'AdamW', 'optimizer_params': {'lr': 2.5e-05, 'weight_decay': 0.0001}, 'chop_head': False, 'scheduler': 'CosineAnnealingLR', 'scheduler_params': {'T_max': 30, 'eta_min': 2.5e-06}},
 'convpass_bottleneck': 8,
 'convpass_init': 'lora_xavier',
 'convpass_scaler': 10,
 'convpass_xavier_init': False,
 'debug': False,
 'device': 'cuda',
 'difffit': False,
 'drop_path_rate': 0.0,
 'eval_only': False,
 'eval_per_epoch': False,
 'fact_dim': 8,
 'fact_scaler': 1.0,
 'fact_type': None,
 'ft_attn_ln': 'before',
 'ft_attn_mode': 'parallel',
 'ft_attn_module': None,
 'ft_mlp_ln': 'before',
 'ft_mlp_mode': 'parallel',
 'ft_mlp_module': None,
 'full': True,
 'generalization_test': 'a',
 'gpu_id': None,
 'gpu_memory_monitor': False,
 'interpolation_alpha': 0.5,
 'interpolation_head': False,
 'interpolation_model': False,
 'is_save': False,
 'label_type': 'common',
 'ln': False,
 'log_path': '/fs/scratch/PAS2099/mino/ICICLE/log_auto/pipeline/serengeti_serengeti_M10/zs/2025-07-12-15-57-29/',
 'lora_bottleneck': 0,
 'merge_factor': 1,
 'mlp_index': None,
 'mlp_type': 'full',
 'module_name': 'zs',
 'no_gpu_monitor_colors': False,
 'ood_config': {'method': 'none'},
 'pretrain_config': {'pretrain': False},
 'pretrained_weights': 'bioclip2',
 'repadapter_bottleneck': 8,
 'repadapter_group': 2,
 'repadapter_init': 'lora_xavier',
 'repadapter_scaler': 1,
 'save_dir': '/fs/scratch/PAS2099/mino/ICICLE/log_auto/pipeline/serengeti_serengeti_M10/zs/2025-07-12-15-57-29/bioclip2/full_text_head/2025-07-12-15-57-33/log',
 'seed': 9527,
 'ssf': False,
 'text': 'head',
 'text_template': 'openai',
 'vpt_dropout': 0.1,
 'vpt_layer': None,
 'vpt_mode': None,
 'vpt_num': 10,
 'vqt_dropout': 0.1,
 'vqt_num': 0,
 'wandb': True}
2025-07-12 15:57:34,654 - root - INFO - Using Bioclip-2 model. 
2025-07-12 15:57:34,654 - root - INFO - Loaded ViT-L-14 model config.
2025-07-12 15:57:36,585 - root - INFO - Loading pretrained ViT-L-14 weights (pretrained_weights/bioclip-2/open_clip_pytorch_model.bin).
2025-07-12 15:57:39,242 - root - INFO - Skipping pretraining... 
2025-07-12 15:57:39,253 - root - INFO - Checkpoint list, length: 8: 
2025-07-12 15:57:39,253 - root - INFO - 	ckp_1 
2025-07-12 15:57:39,253 - root - INFO - 	ckp_2 
2025-07-12 15:57:39,253 - root - INFO - 	ckp_3 
2025-07-12 15:57:39,253 - root - INFO - 	ckp_4 
2025-07-12 15:57:39,253 - root - INFO - 	ckp_5 
2025-07-12 15:57:39,254 - root - INFO - 	ckp_6 
2025-07-12 15:57:39,254 - root - INFO - 	ckp_7 
2025-07-12 15:57:39,254 - root - INFO - 	ckp_8 
2025-07-12 15:57:39,268 - root - INFO - Training on checkpoint ckp_1. 
2025-07-12 15:57:39,268 - root - INFO - Subset length: 0
2025-07-12 15:57:39,269 - root - INFO - Gathering samples from checkpoints: ['ckp_1']
2025-07-12 15:57:39,270 - root - INFO - Subset length: 66
2025-07-12 15:57:39,270 - root - INFO - Training dataset size: 0. 
2025-07-12 15:57:39,270 - root - INFO - Evaluation dataset size: 66. 
2025-07-12 15:57:39,271 - root - INFO - OOD mask: 0 / 0. 
2025-07-12 15:57:39,272 - root - INFO - AL mask: 0 / 0. 
2025-07-12 15:57:39,272 - root - INFO - Evaluating on next checkpoint ckp_1. 
2025-07-12 15:57:40,309 - root - INFO - Number of samples: 66, acc: 0.7727, balanced acc: 0.7611, loss: 2.6275. 
2025-07-12 15:57:40,310 - root - INFO - Saving predictions to /fs/scratch/PAS2099/mino/ICICLE/log_auto/pipeline/serengeti_serengeti_M10/zs/2025-07-12-15-57-29/bioclip2/full_text_head/2025-07-12-15-57-33/log. 
2025-07-12 15:57:40,311 - root - INFO - Training on checkpoint ckp_2. 
2025-07-12 15:57:40,311 - root - INFO - Gathering samples from checkpoints: ['ckp_1']
2025-07-12 15:57:40,313 - root - INFO - Subset length: 105
2025-07-12 15:57:40,313 - root - INFO - Gathering samples from checkpoints: ['ckp_2']
2025-07-12 15:57:40,314 - root - INFO - Subset length: 23
2025-07-12 15:57:40,314 - root - INFO - Training dataset size: 105. 
2025-07-12 15:57:40,314 - root - INFO - Evaluation dataset size: 23. 
2025-07-12 15:57:40,314 - root - INFO - OOD mask: 0 / 105. 
2025-07-12 15:57:40,314 - root - INFO - AL mask: 0 / 105. 
2025-07-12 15:57:40,314 - root - INFO - Evaluating on current checkpoint ckp_1. 
2025-07-12 15:57:40,314 - root - INFO - Gathering samples from checkpoints: ['ckp_1']
2025-07-12 15:57:40,316 - root - INFO - Subset length: 66
2025-07-12 15:57:40,910 - root - INFO - Eval on current training checkpoint ckp_1: Number of samples: 66, acc: 0.7727, balanced acc: 0.7611, loss: 2.6275. 
2025-07-12 15:57:40,910 - root - INFO - Evaluating on next checkpoint ckp_2. 
2025-07-12 15:57:41,252 - root - INFO - Number of samples: 23, acc: 0.3913, balanced acc: 0.3750, loss: 2.6506. 
2025-07-12 15:57:41,253 - root - INFO - Saving predictions to /fs/scratch/PAS2099/mino/ICICLE/log_auto/pipeline/serengeti_serengeti_M10/zs/2025-07-12-15-57-29/bioclip2/full_text_head/2025-07-12-15-57-33/log. 
2025-07-12 15:57:41,254 - root - INFO - Training on checkpoint ckp_3. 
2025-07-12 15:57:41,254 - root - INFO - Gathering samples from checkpoints: ['ckp_2']
2025-07-12 15:57:41,260 - root - INFO - Subset length: 251
2025-07-12 15:57:41,260 - root - INFO - Gathering samples from checkpoints: ['ckp_3']
2025-07-12 15:57:41,261 - root - INFO - Subset length: 64
2025-07-12 15:57:41,261 - root - INFO - Training dataset size: 251. 
2025-07-12 15:57:41,261 - root - INFO - Evaluation dataset size: 64. 
2025-07-12 15:57:41,261 - root - INFO - OOD mask: 0 / 251. 
2025-07-12 15:57:41,261 - root - INFO - AL mask: 0 / 251. 
2025-07-12 15:57:41,261 - root - INFO - Evaluating on current checkpoint ckp_2. 
2025-07-12 15:57:41,262 - root - INFO - Gathering samples from checkpoints: ['ckp_2']
2025-07-12 15:57:41,262 - root - INFO - Subset length: 23
2025-07-12 15:57:41,474 - root - INFO - Eval on current training checkpoint ckp_2: Number of samples: 23, acc: 0.3913, balanced acc: 0.3750, loss: 2.6506. 
2025-07-12 15:57:41,475 - root - INFO - Evaluating on next checkpoint ckp_3. 
2025-07-12 15:57:42,622 - root - INFO - Number of samples: 64, acc: 0.7031, balanced acc: 0.6952, loss: 2.6170. 
2025-07-12 15:57:42,623 - root - INFO - Saving predictions to /fs/scratch/PAS2099/mino/ICICLE/log_auto/pipeline/serengeti_serengeti_M10/zs/2025-07-12-15-57-29/bioclip2/full_text_head/2025-07-12-15-57-33/log. 
2025-07-12 15:57:42,624 - root - INFO - Training on checkpoint ckp_4. 
2025-07-12 15:57:42,624 - root - INFO - Gathering samples from checkpoints: ['ckp_3']
2025-07-12 15:57:42,626 - root - INFO - Subset length: 99
2025-07-12 15:57:42,627 - root - INFO - Gathering samples from checkpoints: ['ckp_4']
2025-07-12 15:57:42,628 - root - INFO - Subset length: 67
2025-07-12 15:57:42,628 - root - INFO - Training dataset size: 99. 
2025-07-12 15:57:42,628 - root - INFO - Evaluation dataset size: 67. 
2025-07-12 15:57:42,628 - root - INFO - OOD mask: 0 / 99. 
2025-07-12 15:57:42,628 - root - INFO - AL mask: 0 / 99. 
2025-07-12 15:57:42,628 - root - INFO - Evaluating on current checkpoint ckp_3. 
2025-07-12 15:57:42,629 - root - INFO - Gathering samples from checkpoints: ['ckp_3']
2025-07-12 15:57:42,630 - root - INFO - Subset length: 64
2025-07-12 15:57:43,300 - root - INFO - Eval on current training checkpoint ckp_3: Number of samples: 64, acc: 0.7031, balanced acc: 0.6952, loss: 2.6170. 
2025-07-12 15:57:43,300 - root - INFO - Evaluating on next checkpoint ckp_4. 
2025-07-12 15:57:44,528 - root - INFO - Number of samples: 67, acc: 0.6716, balanced acc: 0.6679, loss: 2.6297. 
2025-07-12 15:57:44,529 - root - INFO - Saving predictions to /fs/scratch/PAS2099/mino/ICICLE/log_auto/pipeline/serengeti_serengeti_M10/zs/2025-07-12-15-57-29/bioclip2/full_text_head/2025-07-12-15-57-33/log. 
2025-07-12 15:57:44,530 - root - INFO - Training on checkpoint ckp_5. 
2025-07-12 15:57:44,530 - root - INFO - Gathering samples from checkpoints: ['ckp_4']
2025-07-12 15:57:44,532 - root - INFO - Subset length: 105
2025-07-12 15:57:44,532 - root - INFO - Gathering samples from checkpoints: ['ckp_5']
2025-07-12 15:57:44,533 - root - INFO - Subset length: 56
2025-07-12 15:57:44,534 - root - INFO - Training dataset size: 105. 
2025-07-12 15:57:44,534 - root - INFO - Evaluation dataset size: 56. 
2025-07-12 15:57:44,534 - root - INFO - OOD mask: 0 / 105. 
2025-07-12 15:57:44,534 - root - INFO - AL mask: 0 / 105. 
2025-07-12 15:57:44,534 - root - INFO - Evaluating on current checkpoint ckp_4. 
2025-07-12 15:57:44,534 - root - INFO - Gathering samples from checkpoints: ['ckp_4']
2025-07-12 15:57:44,535 - root - INFO - Subset length: 67
2025-07-12 15:57:45,250 - root - INFO - Eval on current training checkpoint ckp_4: Number of samples: 67, acc: 0.6716, balanced acc: 0.6679, loss: 2.6297. 
2025-07-12 15:57:45,250 - root - INFO - Evaluating on next checkpoint ckp_5. 
2025-07-12 15:57:46,322 - root - INFO - Number of samples: 56, acc: 0.5179, balanced acc: 0.5333, loss: 2.6327. 
2025-07-12 15:57:46,322 - root - INFO - Saving predictions to /fs/scratch/PAS2099/mino/ICICLE/log_auto/pipeline/serengeti_serengeti_M10/zs/2025-07-12-15-57-29/bioclip2/full_text_head/2025-07-12-15-57-33/log. 
2025-07-12 15:57:46,323 - root - INFO - Training on checkpoint ckp_6. 
2025-07-12 15:57:46,323 - root - INFO - Gathering samples from checkpoints: ['ckp_5']
2025-07-12 15:57:46,326 - root - INFO - Subset length: 122
2025-07-12 15:57:46,326 - root - INFO - Gathering samples from checkpoints: ['ckp_6']
2025-07-12 15:57:46,327 - root - INFO - Subset length: 32
2025-07-12 15:57:46,327 - root - INFO - Training dataset size: 122. 
2025-07-12 15:57:46,327 - root - INFO - Evaluation dataset size: 32. 
2025-07-12 15:57:46,327 - root - INFO - OOD mask: 0 / 122. 
2025-07-12 15:57:46,327 - root - INFO - AL mask: 0 / 122. 
2025-07-12 15:57:46,327 - root - INFO - Evaluating on current checkpoint ckp_5. 
2025-07-12 15:57:46,327 - root - INFO - Gathering samples from checkpoints: ['ckp_5']
2025-07-12 15:57:46,329 - root - INFO - Subset length: 56
2025-07-12 15:57:46,932 - root - INFO - Eval on current training checkpoint ckp_5: Number of samples: 56, acc: 0.5179, balanced acc: 0.5333, loss: 2.6327. 
2025-07-12 15:57:46,932 - root - INFO - Evaluating on next checkpoint ckp_6. 
2025-07-12 15:57:47,602 - root - INFO - Number of samples: 32, acc: 0.8438, balanced acc: 0.8333, loss: 2.6160. 
2025-07-12 15:57:47,602 - root - INFO - Saving predictions to /fs/scratch/PAS2099/mino/ICICLE/log_auto/pipeline/serengeti_serengeti_M10/zs/2025-07-12-15-57-29/bioclip2/full_text_head/2025-07-12-15-57-33/log. 
2025-07-12 15:57:47,603 - root - INFO - Training on checkpoint ckp_7. 
2025-07-12 15:57:47,603 - root - INFO - Gathering samples from checkpoints: ['ckp_6']
2025-07-12 15:57:47,606 - root - INFO - Subset length: 136
2025-07-12 15:57:47,606 - root - INFO - Gathering samples from checkpoints: ['ckp_7']
2025-07-12 15:57:47,607 - root - INFO - Subset length: 31
2025-07-12 15:57:47,607 - root - INFO - Training dataset size: 136. 
2025-07-12 15:57:47,607 - root - INFO - Evaluation dataset size: 31. 
2025-07-12 15:57:47,607 - root - INFO - OOD mask: 0 / 136. 
2025-07-12 15:57:47,607 - root - INFO - AL mask: 0 / 136. 
2025-07-12 15:57:47,608 - root - INFO - Evaluating on current checkpoint ckp_6. 
2025-07-12 15:57:47,608 - root - INFO - Gathering samples from checkpoints: ['ckp_6']
2025-07-12 15:57:47,608 - root - INFO - Subset length: 32
2025-07-12 15:57:47,971 - root - INFO - Eval on current training checkpoint ckp_6: Number of samples: 32, acc: 0.8438, balanced acc: 0.8333, loss: 2.6160. 
2025-07-12 15:57:47,971 - root - INFO - Evaluating on next checkpoint ckp_7. 
2025-07-12 15:57:48,276 - root - INFO - Number of samples: 31, acc: 0.5484, balanced acc: 0.5333, loss: 2.6488. 
2025-07-12 15:57:48,276 - root - INFO - Saving predictions to /fs/scratch/PAS2099/mino/ICICLE/log_auto/pipeline/serengeti_serengeti_M10/zs/2025-07-12-15-57-29/bioclip2/full_text_head/2025-07-12-15-57-33/log. 
2025-07-12 15:57:48,277 - root - INFO - Training on checkpoint ckp_8. 
2025-07-12 15:57:48,277 - root - INFO - Gathering samples from checkpoints: ['ckp_7']
2025-07-12 15:57:48,280 - root - INFO - Subset length: 136
2025-07-12 15:57:48,281 - root - INFO - Gathering samples from checkpoints: ['ckp_8']
2025-07-12 15:57:48,282 - root - INFO - Subset length: 67
2025-07-12 15:57:48,282 - root - INFO - Training dataset size: 136. 
2025-07-12 15:57:48,282 - root - INFO - Evaluation dataset size: 67. 
2025-07-12 15:57:48,282 - root - INFO - OOD mask: 0 / 136. 
2025-07-12 15:57:48,282 - root - INFO - AL mask: 0 / 136. 
2025-07-12 15:57:48,282 - root - INFO - Evaluating on current checkpoint ckp_7. 
2025-07-12 15:57:48,283 - root - INFO - Gathering samples from checkpoints: ['ckp_7']
2025-07-12 15:57:48,283 - root - INFO - Subset length: 31
2025-07-12 15:57:48,488 - root - INFO - Eval on current training checkpoint ckp_7: Number of samples: 31, acc: 0.5484, balanced acc: 0.5333, loss: 2.6488. 
2025-07-12 15:57:48,489 - root - INFO - Evaluating on next checkpoint ckp_8. 
2025-07-12 15:57:49,714 - root - INFO - Number of samples: 67, acc: 0.4627, balanced acc: 0.4528, loss: 2.6531. 
2025-07-12 15:57:49,715 - root - INFO - Saving predictions to /fs/scratch/PAS2099/mino/ICICLE/log_auto/pipeline/serengeti_serengeti_M10/zs/2025-07-12-15-57-29/bioclip2/full_text_head/2025-07-12-15-57-33/log. 
wandb:                                                                                
wandb: 
wandb: Run history:
wandb:          accuracy ▇▁▆▅▃█▃▂
wandb: balanced_accuracy ▇▁▆▅▃█▃▂
wandb: 
wandb: Run summary:
wandb:          accuracy 0.46269
wandb: balanced_accuracy 0.45278
wandb: 
wandb: 🚀 View run serengeti_serengeti_M10 | zs | 2025-07-12-15-57-29 | bioclip2 | full_text_head | 2025-07-12-15-57-33 at: https://wandb.ai/minodaze-the-ohio-state-university/ICICLE-Benchmark/runs/14hrywu0
wandb: ⭐️ View project at: https://wandb.ai/minodaze-the-ohio-state-university/ICICLE-Benchmark
wandb: Synced 5 W&B file(s), 0 media file(s), 0 artifact file(s) and 0 other file(s)
wandb: Find logs at: ./wandb/run-20250712_155733-14hrywu0/logs
2025-07-12 15:57:50,358 - root - INFO - Elapsed time: 16.61 seconds. 
/users/PAS2099/mino/miniconda3/envs/ICICLE/lib/python3.11/site-packages/timm/models/layers/__init__.py:48: FutureWarning: Importing from timm.models.layers is deprecated, please import via timm.layers
  warnings.warn(f"Importing from {__name__} is deprecated, please import via timm.layers", FutureWarning)
2025-07-12 15:57:56,918 - root - INFO - Saving to /fs/scratch/PAS2099/mino/ICICLE/log_auto/pipeline/serengeti_serengeti_C11/zs/2025-07-12-15-57-52/bioclip2/full_text_head/2025-07-12-15-57-56/log. 
wandb: Currently logged in as: minodaze (minodaze-the-ohio-state-university) to https://api.wandb.ai. Use `wandb login --relogin` to force relogin
wandb: Tracking run with wandb version 0.20.1
wandb: Run data is saved locally in /users/PAS2099/mino/ICICLE/wandb/run-20250712_155757-0ac2swni
wandb: Run `wandb offline` to turn off syncing.
wandb: Syncing run serengeti_serengeti_C11 | zs | 2025-07-12-15-57-52 | bioclip2 | full_text_head | 2025-07-12-15-57-56
wandb: ⭐️ View project at https://wandb.ai/minodaze-the-ohio-state-university/ICICLE-Benchmark
wandb: 🚀 View run at https://wandb.ai/minodaze-the-ohio-state-university/ICICLE-Benchmark/runs/0ac2swni
2025-07-12 15:57:57,868 - root - INFO - wandb logging is enabled.
2025-07-12 15:57:57,869 - root - INFO - {'accu_eval': False,
 'adapter_bottleneck': 64,
 'adapter_init': 'lora_kaiming',
 'adapter_scaler': 0.1,
 'al_config': {'method': 'none'},
 'attention_index': None,
 'attention_type': 'full',
 'bitfit': False,
 'block_index': None,
 'c': '/fs/scratch/PAS2099/mino/ICICLE/configs/generated_common/serengeti_serengeti_C11_upper_bound.yaml',
 'cl_config': {'method': 'none'},
 'common_config': {'model': 'bioclip2', 'train_data_config_path': '/fs/scratch/PAS2099/camera-trap-benchmark/serengeti/serengeti_C11/30/train.json', 'eval_data_config_path': '/fs/scratch/PAS2099/camera-trap-benchmark/serengeti/serengeti_C11/30/test.json', 'all_data_config_path': '/fs/scratch/PAS2099/camera-trap-benchmark/serengeti/serengeti_C11/30/train-all.json', 'train_batch_size': 32, 'eval_batch_size': 512, 'optimizer_name': 'AdamW', 'optimizer_params': {'lr': 2.5e-05, 'weight_decay': 0.0001}, 'chop_head': False, 'scheduler': 'CosineAnnealingLR', 'scheduler_params': {'T_max': 30, 'eta_min': 2.5e-06}},
 'convpass_bottleneck': 8,
 'convpass_init': 'lora_xavier',
 'convpass_scaler': 10,
 'convpass_xavier_init': False,
 'debug': False,
 'device': 'cuda',
 'difffit': False,
 'drop_path_rate': 0.0,
 'eval_only': False,
 'eval_per_epoch': False,
 'fact_dim': 8,
 'fact_scaler': 1.0,
 'fact_type': None,
 'ft_attn_ln': 'before',
 'ft_attn_mode': 'parallel',
 'ft_attn_module': None,
 'ft_mlp_ln': 'before',
 'ft_mlp_mode': 'parallel',
 'ft_mlp_module': None,
 'full': True,
 'generalization_test': 'a',
 'gpu_id': None,
 'gpu_memory_monitor': False,
 'interpolation_alpha': 0.5,
 'interpolation_head': False,
 'interpolation_model': False,
 'is_save': False,
 'label_type': 'common',
 'ln': False,
 'log_path': '/fs/scratch/PAS2099/mino/ICICLE/log_auto/pipeline/serengeti_serengeti_C11/zs/2025-07-12-15-57-52/',
 'lora_bottleneck': 0,
 'merge_factor': 1,
 'mlp_index': None,
 'mlp_type': 'full',
 'module_name': 'zs',
 'no_gpu_monitor_colors': False,
 'ood_config': {'method': 'none'},
 'pretrain_config': {'pretrain': False},
 'pretrained_weights': 'bioclip2',
 'repadapter_bottleneck': 8,
 'repadapter_group': 2,
 'repadapter_init': 'lora_xavier',
 'repadapter_scaler': 1,
 'save_dir': '/fs/scratch/PAS2099/mino/ICICLE/log_auto/pipeline/serengeti_serengeti_C11/zs/2025-07-12-15-57-52/bioclip2/full_text_head/2025-07-12-15-57-56/log',
 'seed': 9527,
 'ssf': False,
 'text': 'head',
 'text_template': 'openai',
 'vpt_dropout': 0.1,
 'vpt_layer': None,
 'vpt_mode': None,
 'vpt_num': 10,
 'vqt_dropout': 0.1,
 'vqt_num': 0,
 'wandb': True}
2025-07-12 15:57:57,889 - root - INFO - Using Bioclip-2 model. 
2025-07-12 15:57:57,889 - root - INFO - Loaded ViT-L-14 model config.
2025-07-12 15:57:59,812 - root - INFO - Loading pretrained ViT-L-14 weights (pretrained_weights/bioclip-2/open_clip_pytorch_model.bin).
2025-07-12 15:58:02,248 - root - INFO - Skipping pretraining... 
2025-07-12 15:58:02,302 - root - INFO - Checkpoint list, length: 16: 
2025-07-12 15:58:02,302 - root - INFO - 	ckp_1 
2025-07-12 15:58:02,302 - root - INFO - 	ckp_2 
2025-07-12 15:58:02,302 - root - INFO - 	ckp_3 
2025-07-12 15:58:02,302 - root - INFO - 	ckp_4 
2025-07-12 15:58:02,302 - root - INFO - 	ckp_5 
2025-07-12 15:58:02,302 - root - INFO - 	ckp_6 
2025-07-12 15:58:02,302 - root - INFO - 	ckp_7 
2025-07-12 15:58:02,302 - root - INFO - 	ckp_8 
2025-07-12 15:58:02,302 - root - INFO - 	ckp_9 
2025-07-12 15:58:02,302 - root - INFO - 	ckp_10 
2025-07-12 15:58:02,302 - root - INFO - 	ckp_11 
2025-07-12 15:58:02,302 - root - INFO - 	ckp_12 
2025-07-12 15:58:02,302 - root - INFO - 	ckp_13 
2025-07-12 15:58:02,302 - root - INFO - 	ckp_14 
2025-07-12 15:58:02,302 - root - INFO - 	ckp_15 
2025-07-12 15:58:02,302 - root - INFO - 	ckp_16 
2025-07-12 15:58:02,485 - root - INFO - Training on checkpoint ckp_1. 
2025-07-12 15:58:02,486 - root - INFO - Subset length: 0
2025-07-12 15:58:02,486 - root - INFO - Gathering samples from checkpoints: ['ckp_1']
2025-07-12 15:58:02,487 - root - INFO - Subset length: 76
2025-07-12 15:58:02,488 - root - INFO - Training dataset size: 0. 
2025-07-12 15:58:02,488 - root - INFO - Evaluation dataset size: 76. 
2025-07-12 15:58:02,488 - root - INFO - OOD mask: 0 / 0. 
2025-07-12 15:58:02,488 - root - INFO - AL mask: 0 / 0. 
2025-07-12 15:58:02,488 - root - INFO - Evaluating on next checkpoint ckp_1. 
2025-07-12 15:58:03,762 - root - INFO - Number of samples: 76, acc: 0.5921, balanced acc: 0.5900, loss: 2.7635. 
2025-07-12 15:58:03,762 - root - INFO - Saving predictions to /fs/scratch/PAS2099/mino/ICICLE/log_auto/pipeline/serengeti_serengeti_C11/zs/2025-07-12-15-57-52/bioclip2/full_text_head/2025-07-12-15-57-56/log. 
2025-07-12 15:58:03,763 - root - INFO - Training on checkpoint ckp_2. 
2025-07-12 15:58:03,763 - root - INFO - Gathering samples from checkpoints: ['ckp_1']
2025-07-12 15:58:03,779 - root - INFO - Subset length: 774
2025-07-12 15:58:03,779 - root - INFO - Gathering samples from checkpoints: ['ckp_2']
2025-07-12 15:58:03,781 - root - INFO - Subset length: 65
2025-07-12 15:58:03,781 - root - INFO - Training dataset size: 774. 
2025-07-12 15:58:03,781 - root - INFO - Evaluation dataset size: 65. 
2025-07-12 15:58:03,781 - root - INFO - OOD mask: 0 / 774. 
2025-07-12 15:58:03,781 - root - INFO - AL mask: 0 / 774. 
2025-07-12 15:58:03,781 - root - INFO - Evaluating on current checkpoint ckp_1. 
2025-07-12 15:58:03,781 - root - INFO - Gathering samples from checkpoints: ['ckp_1']
2025-07-12 15:58:03,783 - root - INFO - Subset length: 76
2025-07-12 15:58:04,492 - root - INFO - Eval on current training checkpoint ckp_1: Number of samples: 76, acc: 0.5921, balanced acc: 0.5900, loss: 2.7635. 
2025-07-12 15:58:04,492 - root - INFO - Evaluating on next checkpoint ckp_2. 
2025-07-12 15:58:05,309 - root - INFO - Number of samples: 65, acc: 0.8923, balanced acc: 0.8861, loss: 2.7428. 
2025-07-12 15:58:05,310 - root - INFO - Saving predictions to /fs/scratch/PAS2099/mino/ICICLE/log_auto/pipeline/serengeti_serengeti_C11/zs/2025-07-12-15-57-52/bioclip2/full_text_head/2025-07-12-15-57-56/log. 
2025-07-12 15:58:05,311 - root - INFO - Training on checkpoint ckp_3. 
2025-07-12 15:58:05,311 - root - INFO - Gathering samples from checkpoints: ['ckp_2']
2025-07-12 15:58:05,313 - root - INFO - Subset length: 107
2025-07-12 15:58:05,314 - root - INFO - Gathering samples from checkpoints: ['ckp_3']
2025-07-12 15:58:05,315 - root - INFO - Subset length: 52
2025-07-12 15:58:05,315 - root - INFO - Training dataset size: 107. 
2025-07-12 15:58:05,315 - root - INFO - Evaluation dataset size: 52. 
2025-07-12 15:58:05,315 - root - INFO - OOD mask: 0 / 107. 
2025-07-12 15:58:05,315 - root - INFO - AL mask: 0 / 107. 
2025-07-12 15:58:05,315 - root - INFO - Evaluating on current checkpoint ckp_2. 
2025-07-12 15:58:05,315 - root - INFO - Gathering samples from checkpoints: ['ckp_2']
2025-07-12 15:58:05,317 - root - INFO - Subset length: 65
2025-07-12 15:58:05,818 - root - INFO - Eval on current training checkpoint ckp_2: Number of samples: 65, acc: 0.8923, balanced acc: 0.8861, loss: 2.7428. 
2025-07-12 15:58:05,818 - root - INFO - Evaluating on next checkpoint ckp_3. 
2025-07-12 15:58:06,379 - root - INFO - Number of samples: 52, acc: 0.7308, balanced acc: 0.7255, loss: 2.7522. 
2025-07-12 15:58:06,379 - root - INFO - Saving predictions to /fs/scratch/PAS2099/mino/ICICLE/log_auto/pipeline/serengeti_serengeti_C11/zs/2025-07-12-15-57-52/bioclip2/full_text_head/2025-07-12-15-57-56/log. 
2025-07-12 15:58:06,380 - root - INFO - Training on checkpoint ckp_4. 
2025-07-12 15:58:06,380 - root - INFO - Gathering samples from checkpoints: ['ckp_3']
2025-07-12 15:58:06,545 - root - INFO - Subset length: 1507
2025-07-12 15:58:06,546 - root - INFO - Gathering samples from checkpoints: ['ckp_4']
2025-07-12 15:58:06,547 - root - INFO - Subset length: 64
2025-07-12 15:58:06,547 - root - INFO - Training dataset size: 1507. 
2025-07-12 15:58:06,547 - root - INFO - Evaluation dataset size: 64. 
2025-07-12 15:58:06,547 - root - INFO - OOD mask: 0 / 1507. 
2025-07-12 15:58:06,547 - root - INFO - AL mask: 0 / 1507. 
2025-07-12 15:58:06,548 - root - INFO - Evaluating on current checkpoint ckp_3. 
2025-07-12 15:58:06,548 - root - INFO - Gathering samples from checkpoints: ['ckp_3']
2025-07-12 15:58:06,549 - root - INFO - Subset length: 52
2025-07-12 15:58:06,925 - root - INFO - Eval on current training checkpoint ckp_3: Number of samples: 52, acc: 0.7308, balanced acc: 0.7255, loss: 2.7522. 
2025-07-12 15:58:06,926 - root - INFO - Evaluating on next checkpoint ckp_4. 
2025-07-12 15:58:07,481 - root - INFO - Number of samples: 64, acc: 0.6562, balanced acc: 0.6727, loss: 2.7610. 
2025-07-12 15:58:07,482 - root - INFO - Saving predictions to /fs/scratch/PAS2099/mino/ICICLE/log_auto/pipeline/serengeti_serengeti_C11/zs/2025-07-12-15-57-52/bioclip2/full_text_head/2025-07-12-15-57-56/log. 
2025-07-12 15:58:07,482 - root - INFO - Training on checkpoint ckp_5. 
2025-07-12 15:58:07,482 - root - INFO - Gathering samples from checkpoints: ['ckp_4']
2025-07-12 15:58:07,485 - root - INFO - Subset length: 112
2025-07-12 15:58:07,486 - root - INFO - Gathering samples from checkpoints: ['ckp_5']
2025-07-12 15:58:07,489 - root - INFO - Subset length: 65
2025-07-12 15:58:07,489 - root - INFO - Training dataset size: 112. 
2025-07-12 15:58:07,489 - root - INFO - Evaluation dataset size: 65. 
2025-07-12 15:58:07,490 - root - INFO - OOD mask: 0 / 112. 
2025-07-12 15:58:07,490 - root - INFO - AL mask: 0 / 112. 
2025-07-12 15:58:07,490 - root - INFO - Evaluating on current checkpoint ckp_4. 
2025-07-12 15:58:07,490 - root - INFO - Gathering samples from checkpoints: ['ckp_4']
2025-07-12 15:58:07,491 - root - INFO - Subset length: 64
2025-07-12 15:58:07,886 - root - INFO - Eval on current training checkpoint ckp_4: Number of samples: 64, acc: 0.6562, balanced acc: 0.6727, loss: 2.7610. 
2025-07-12 15:58:07,886 - root - INFO - Evaluating on next checkpoint ckp_5. 
2025-07-12 15:58:08,557 - root - INFO - Number of samples: 65, acc: 0.5538, balanced acc: 0.5571, loss: 2.7536. 
2025-07-12 15:58:08,558 - root - INFO - Saving predictions to /fs/scratch/PAS2099/mino/ICICLE/log_auto/pipeline/serengeti_serengeti_C11/zs/2025-07-12-15-57-52/bioclip2/full_text_head/2025-07-12-15-57-56/log. 
2025-07-12 15:58:08,558 - root - INFO - Training on checkpoint ckp_6. 
2025-07-12 15:58:08,558 - root - INFO - Gathering samples from checkpoints: ['ckp_5']
2025-07-12 15:58:08,561 - root - INFO - Subset length: 100
2025-07-12 15:58:08,561 - root - INFO - Gathering samples from checkpoints: ['ckp_6']
2025-07-12 15:58:08,562 - root - INFO - Subset length: 46
2025-07-12 15:58:08,562 - root - INFO - Training dataset size: 100. 
2025-07-12 15:58:08,562 - root - INFO - Evaluation dataset size: 46. 
2025-07-12 15:58:08,562 - root - INFO - OOD mask: 0 / 100. 
2025-07-12 15:58:08,562 - root - INFO - AL mask: 0 / 100. 
2025-07-12 15:58:08,563 - root - INFO - Evaluating on current checkpoint ckp_5. 
2025-07-12 15:58:08,563 - root - INFO - Gathering samples from checkpoints: ['ckp_5']
2025-07-12 15:58:08,564 - root - INFO - Subset length: 65
2025-07-12 15:58:08,987 - root - INFO - Eval on current training checkpoint ckp_5: Number of samples: 65, acc: 0.5538, balanced acc: 0.5571, loss: 2.7536. 
2025-07-12 15:58:08,987 - root - INFO - Evaluating on next checkpoint ckp_6. 
2025-07-12 15:58:09,435 - root - INFO - Number of samples: 46, acc: 0.9348, balanced acc: 0.9375, loss: 2.7459. 
2025-07-12 15:58:09,436 - root - INFO - Saving predictions to /fs/scratch/PAS2099/mino/ICICLE/log_auto/pipeline/serengeti_serengeti_C11/zs/2025-07-12-15-57-52/bioclip2/full_text_head/2025-07-12-15-57-56/log. 
2025-07-12 15:58:09,437 - root - INFO - Training on checkpoint ckp_7. 
2025-07-12 15:58:09,437 - root - INFO - Gathering samples from checkpoints: ['ckp_6']
2025-07-12 15:58:09,440 - root - INFO - Subset length: 127
2025-07-12 15:58:09,440 - root - INFO - Gathering samples from checkpoints: ['ckp_7']
2025-07-12 15:58:09,442 - root - INFO - Subset length: 73
2025-07-12 15:58:09,442 - root - INFO - Training dataset size: 127. 
2025-07-12 15:58:09,442 - root - INFO - Evaluation dataset size: 73. 
2025-07-12 15:58:09,442 - root - INFO - OOD mask: 0 / 127. 
2025-07-12 15:58:09,442 - root - INFO - AL mask: 0 / 127. 
2025-07-12 15:58:09,442 - root - INFO - Evaluating on current checkpoint ckp_6. 
2025-07-12 15:58:09,442 - root - INFO - Gathering samples from checkpoints: ['ckp_6']
2025-07-12 15:58:09,443 - root - INFO - Subset length: 46
2025-07-12 15:58:09,741 - root - INFO - Eval on current training checkpoint ckp_6: Number of samples: 46, acc: 0.9348, balanced acc: 0.9375, loss: 2.7459. 
2025-07-12 15:58:09,741 - root - INFO - Evaluating on next checkpoint ckp_7. 
2025-07-12 15:58:10,591 - root - INFO - Number of samples: 73, acc: 0.9726, balanced acc: 0.9740, loss: 2.7213. 
2025-07-12 15:58:10,591 - root - INFO - Saving predictions to /fs/scratch/PAS2099/mino/ICICLE/log_auto/pipeline/serengeti_serengeti_C11/zs/2025-07-12-15-57-52/bioclip2/full_text_head/2025-07-12-15-57-56/log. 
2025-07-12 15:58:10,592 - root - INFO - Training on checkpoint ckp_8. 
2025-07-12 15:58:10,592 - root - INFO - Gathering samples from checkpoints: ['ckp_7']
2025-07-12 15:58:10,603 - root - INFO - Subset length: 515
2025-07-12 15:58:10,603 - root - INFO - Gathering samples from checkpoints: ['ckp_8']
2025-07-12 15:58:10,604 - root - INFO - Subset length: 47
2025-07-12 15:58:10,604 - root - INFO - Training dataset size: 515. 
2025-07-12 15:58:10,604 - root - INFO - Evaluation dataset size: 47. 
2025-07-12 15:58:10,604 - root - INFO - OOD mask: 0 / 515. 
2025-07-12 15:58:10,604 - root - INFO - AL mask: 0 / 515. 
2025-07-12 15:58:10,605 - root - INFO - Evaluating on current checkpoint ckp_7. 
2025-07-12 15:58:10,605 - root - INFO - Gathering samples from checkpoints: ['ckp_7']
2025-07-12 15:58:10,606 - root - INFO - Subset length: 73
2025-07-12 15:58:11,130 - root - INFO - Eval on current training checkpoint ckp_7: Number of samples: 73, acc: 0.9726, balanced acc: 0.9740, loss: 2.7213. 
2025-07-12 15:58:11,130 - root - INFO - Evaluating on next checkpoint ckp_8. 
2025-07-12 15:58:11,614 - root - INFO - Number of samples: 47, acc: 0.8936, balanced acc: 0.8958, loss: 2.7280. 
2025-07-12 15:58:11,615 - root - INFO - Saving predictions to /fs/scratch/PAS2099/mino/ICICLE/log_auto/pipeline/serengeti_serengeti_C11/zs/2025-07-12-15-57-52/bioclip2/full_text_head/2025-07-12-15-57-56/log. 
2025-07-12 15:58:11,615 - root - INFO - Training on checkpoint ckp_9. 
2025-07-12 15:58:11,616 - root - INFO - Gathering samples from checkpoints: ['ckp_8']
2025-07-12 15:58:11,619 - root - INFO - Subset length: 126
2025-07-12 15:58:11,619 - root - INFO - Gathering samples from checkpoints: ['ckp_9']
2025-07-12 15:58:11,620 - root - INFO - Subset length: 30
2025-07-12 15:58:11,620 - root - INFO - Training dataset size: 126. 
2025-07-12 15:58:11,620 - root - INFO - Evaluation dataset size: 30. 
2025-07-12 15:58:11,620 - root - INFO - OOD mask: 0 / 126. 
2025-07-12 15:58:11,620 - root - INFO - AL mask: 0 / 126. 
2025-07-12 15:58:11,620 - root - INFO - Evaluating on current checkpoint ckp_8. 
2025-07-12 15:58:11,620 - root - INFO - Gathering samples from checkpoints: ['ckp_8']
2025-07-12 15:58:11,622 - root - INFO - Subset length: 47
2025-07-12 15:58:11,936 - root - INFO - Eval on current training checkpoint ckp_8: Number of samples: 47, acc: 0.8936, balanced acc: 0.8958, loss: 2.7280. 
2025-07-12 15:58:11,936 - root - INFO - Evaluating on next checkpoint ckp_9. 
2025-07-12 15:58:12,265 - root - INFO - Number of samples: 30, acc: 0.7667, balanced acc: 0.7667, loss: 2.7366. 
2025-07-12 15:58:12,266 - root - INFO - Saving predictions to /fs/scratch/PAS2099/mino/ICICLE/log_auto/pipeline/serengeti_serengeti_C11/zs/2025-07-12-15-57-52/bioclip2/full_text_head/2025-07-12-15-57-56/log. 
2025-07-12 15:58:12,266 - root - INFO - Training on checkpoint ckp_10. 
2025-07-12 15:58:12,267 - root - INFO - Gathering samples from checkpoints: ['ckp_9']
2025-07-12 15:58:12,270 - root - INFO - Subset length: 150
2025-07-12 15:58:12,270 - root - INFO - Gathering samples from checkpoints: ['ckp_10']
2025-07-12 15:58:12,273 - root - INFO - Subset length: 97
2025-07-12 15:58:12,273 - root - INFO - Training dataset size: 150. 
2025-07-12 15:58:12,273 - root - INFO - Evaluation dataset size: 97. 
2025-07-12 15:58:12,273 - root - INFO - OOD mask: 0 / 150. 
2025-07-12 15:58:12,273 - root - INFO - AL mask: 0 / 150. 
2025-07-12 15:58:12,273 - root - INFO - Evaluating on current checkpoint ckp_9. 
2025-07-12 15:58:12,273 - root - INFO - Gathering samples from checkpoints: ['ckp_9']
2025-07-12 15:58:12,274 - root - INFO - Subset length: 30
2025-07-12 15:58:12,479 - root - INFO - Eval on current training checkpoint ckp_9: Number of samples: 30, acc: 0.7667, balanced acc: 0.7667, loss: 2.7366. 
2025-07-12 15:58:12,479 - root - INFO - Evaluating on next checkpoint ckp_10. 
2025-07-12 15:58:14,537 - root - INFO - Number of samples: 97, acc: 0.7835, balanced acc: 0.7773, loss: 2.7456. 
2025-07-12 15:58:14,538 - root - INFO - Saving predictions to /fs/scratch/PAS2099/mino/ICICLE/log_auto/pipeline/serengeti_serengeti_C11/zs/2025-07-12-15-57-52/bioclip2/full_text_head/2025-07-12-15-57-56/log. 
2025-07-12 15:58:14,539 - root - INFO - Training on checkpoint ckp_11. 
2025-07-12 15:58:14,539 - root - INFO - Gathering samples from checkpoints: ['ckp_10']
2025-07-12 15:58:14,554 - root - INFO - Subset length: 787
2025-07-12 15:58:14,555 - root - INFO - Gathering samples from checkpoints: ['ckp_11']
2025-07-12 15:58:14,556 - root - INFO - Subset length: 56
2025-07-12 15:58:14,556 - root - INFO - Training dataset size: 787. 
2025-07-12 15:58:14,556 - root - INFO - Evaluation dataset size: 56. 
2025-07-12 15:58:14,556 - root - INFO - OOD mask: 0 / 787. 
2025-07-12 15:58:14,556 - root - INFO - AL mask: 0 / 787. 
2025-07-12 15:58:14,556 - root - INFO - Evaluating on current checkpoint ckp_10. 
2025-07-12 15:58:14,556 - root - INFO - Gathering samples from checkpoints: ['ckp_10']
2025-07-12 15:58:14,558 - root - INFO - Subset length: 97
2025-07-12 15:58:15,692 - root - INFO - Eval on current training checkpoint ckp_10: Number of samples: 97, acc: 0.7835, balanced acc: 0.7773, loss: 2.7456. 
2025-07-12 15:58:15,692 - root - INFO - Evaluating on next checkpoint ckp_11. 
2025-07-12 15:58:16,549 - root - INFO - Number of samples: 56, acc: 0.9107, balanced acc: 0.9033, loss: 2.7293. 
2025-07-12 15:58:16,549 - root - INFO - Saving predictions to /fs/scratch/PAS2099/mino/ICICLE/log_auto/pipeline/serengeti_serengeti_C11/zs/2025-07-12-15-57-52/bioclip2/full_text_head/2025-07-12-15-57-56/log. 
2025-07-12 15:58:16,552 - root - INFO - Training on checkpoint ckp_12. 
2025-07-12 15:58:16,552 - root - INFO - Gathering samples from checkpoints: ['ckp_11']
2025-07-12 15:58:16,556 - root - INFO - Subset length: 122
2025-07-12 15:58:16,556 - root - INFO - Gathering samples from checkpoints: ['ckp_12']
2025-07-12 15:58:16,558 - root - INFO - Subset length: 67
2025-07-12 15:58:16,558 - root - INFO - Training dataset size: 122. 
2025-07-12 15:58:16,558 - root - INFO - Evaluation dataset size: 67. 
2025-07-12 15:58:16,558 - root - INFO - OOD mask: 0 / 122. 
2025-07-12 15:58:16,558 - root - INFO - AL mask: 0 / 122. 
2025-07-12 15:58:16,558 - root - INFO - Evaluating on current checkpoint ckp_11. 
2025-07-12 15:58:16,558 - root - INFO - Gathering samples from checkpoints: ['ckp_11']
2025-07-12 15:58:16,559 - root - INFO - Subset length: 56
2025-07-12 15:58:17,064 - root - INFO - Eval on current training checkpoint ckp_11: Number of samples: 56, acc: 0.9107, balanced acc: 0.9033, loss: 2.7293. 
2025-07-12 15:58:17,064 - root - INFO - Evaluating on next checkpoint ckp_12. 
2025-07-12 15:58:17,940 - root - INFO - Number of samples: 67, acc: 0.8955, balanced acc: 0.8904, loss: 2.7387. 
2025-07-12 15:58:17,941 - root - INFO - Saving predictions to /fs/scratch/PAS2099/mino/ICICLE/log_auto/pipeline/serengeti_serengeti_C11/zs/2025-07-12-15-57-52/bioclip2/full_text_head/2025-07-12-15-57-56/log. 
2025-07-12 15:58:17,942 - root - INFO - Training on checkpoint ckp_13. 
2025-07-12 15:58:17,942 - root - INFO - Gathering samples from checkpoints: ['ckp_12']
2025-07-12 15:58:17,945 - root - INFO - Subset length: 111
2025-07-12 15:58:17,945 - root - INFO - Gathering samples from checkpoints: ['ckp_13']
2025-07-12 15:58:17,947 - root - INFO - Subset length: 94
2025-07-12 15:58:17,947 - root - INFO - Training dataset size: 111. 
2025-07-12 15:58:17,947 - root - INFO - Evaluation dataset size: 94. 
2025-07-12 15:58:17,947 - root - INFO - OOD mask: 0 / 111. 
2025-07-12 15:58:17,948 - root - INFO - AL mask: 0 / 111. 
2025-07-12 15:58:17,948 - root - INFO - Evaluating on current checkpoint ckp_12. 
2025-07-12 15:58:17,948 - root - INFO - Gathering samples from checkpoints: ['ckp_12']
2025-07-12 15:58:17,949 - root - INFO - Subset length: 67
2025-07-12 15:58:18,470 - root - INFO - Eval on current training checkpoint ckp_12: Number of samples: 67, acc: 0.8955, balanced acc: 0.8904, loss: 2.7387. 
2025-07-12 15:58:18,470 - root - INFO - Evaluating on next checkpoint ckp_13. 
2025-07-12 15:58:19,817 - root - INFO - Number of samples: 94, acc: 0.8936, balanced acc: 0.8930, loss: 2.7334. 
2025-07-12 15:58:19,818 - root - INFO - Saving predictions to /fs/scratch/PAS2099/mino/ICICLE/log_auto/pipeline/serengeti_serengeti_C11/zs/2025-07-12-15-57-52/bioclip2/full_text_head/2025-07-12-15-57-56/log. 
2025-07-12 15:58:19,818 - root - INFO - Training on checkpoint ckp_14. 
2025-07-12 15:58:19,819 - root - INFO - Gathering samples from checkpoints: ['ckp_13']
2025-07-12 15:58:19,834 - root - INFO - Subset length: 756
2025-07-12 15:58:19,834 - root - INFO - Gathering samples from checkpoints: ['ckp_14']
2025-07-12 15:58:19,836 - root - INFO - Subset length: 72
2025-07-12 15:58:19,836 - root - INFO - Training dataset size: 756. 
2025-07-12 15:58:19,836 - root - INFO - Evaluation dataset size: 72. 
2025-07-12 15:58:19,836 - root - INFO - OOD mask: 0 / 756. 
2025-07-12 15:58:19,836 - root - INFO - AL mask: 0 / 756. 
2025-07-12 15:58:19,836 - root - INFO - Evaluating on current checkpoint ckp_13. 
2025-07-12 15:58:19,836 - root - INFO - Gathering samples from checkpoints: ['ckp_13']
2025-07-12 15:58:19,838 - root - INFO - Subset length: 94
2025-07-12 15:58:20,628 - root - INFO - Eval on current training checkpoint ckp_13: Number of samples: 94, acc: 0.8936, balanced acc: 0.8930, loss: 2.7334. 
2025-07-12 15:58:20,628 - root - INFO - Evaluating on next checkpoint ckp_14. 
2025-07-12 15:58:21,828 - root - INFO - Number of samples: 72, acc: 0.9028, balanced acc: 0.9028, loss: 2.7427. 
2025-07-12 15:58:21,828 - root - INFO - Saving predictions to /fs/scratch/PAS2099/mino/ICICLE/log_auto/pipeline/serengeti_serengeti_C11/zs/2025-07-12-15-57-52/bioclip2/full_text_head/2025-07-12-15-57-56/log. 
2025-07-12 15:58:21,829 - root - INFO - Training on checkpoint ckp_15. 
2025-07-12 15:58:21,829 - root - INFO - Gathering samples from checkpoints: ['ckp_14']
2025-07-12 15:58:21,857 - root - INFO - Subset length: 1391
2025-07-12 15:58:21,858 - root - INFO - Gathering samples from checkpoints: ['ckp_15']
2025-07-12 15:58:21,859 - root - INFO - Subset length: 42
2025-07-12 15:58:21,859 - root - INFO - Training dataset size: 1391. 
2025-07-12 15:58:21,859 - root - INFO - Evaluation dataset size: 42. 
2025-07-12 15:58:21,859 - root - INFO - OOD mask: 0 / 1391. 
2025-07-12 15:58:21,859 - root - INFO - AL mask: 0 / 1391. 
2025-07-12 15:58:21,859 - root - INFO - Evaluating on current checkpoint ckp_14. 
2025-07-12 15:58:21,859 - root - INFO - Gathering samples from checkpoints: ['ckp_14']
2025-07-12 15:58:21,861 - root - INFO - Subset length: 72
2025-07-12 15:58:22,554 - root - INFO - Eval on current training checkpoint ckp_14: Number of samples: 72, acc: 0.9028, balanced acc: 0.9028, loss: 2.7427. 
2025-07-12 15:58:22,554 - root - INFO - Evaluating on next checkpoint ckp_15. 
2025-07-12 15:58:23,214 - root - INFO - Number of samples: 42, acc: 0.8571, balanced acc: 0.8500, loss: 2.7476. 
2025-07-12 15:58:23,215 - root - INFO - Saving predictions to /fs/scratch/PAS2099/mino/ICICLE/log_auto/pipeline/serengeti_serengeti_C11/zs/2025-07-12-15-57-52/bioclip2/full_text_head/2025-07-12-15-57-56/log. 
2025-07-12 15:58:23,216 - root - INFO - Training on checkpoint ckp_16. 
2025-07-12 15:58:23,216 - root - INFO - Gathering samples from checkpoints: ['ckp_15']
2025-07-12 15:58:23,220 - root - INFO - Subset length: 150
2025-07-12 15:58:23,221 - root - INFO - Gathering samples from checkpoints: ['ckp_16']
2025-07-12 15:58:23,223 - root - INFO - Subset length: 94
2025-07-12 15:58:23,223 - root - INFO - Training dataset size: 150. 
2025-07-12 15:58:23,223 - root - INFO - Evaluation dataset size: 94. 
2025-07-12 15:58:23,223 - root - INFO - OOD mask: 0 / 150. 
2025-07-12 15:58:23,223 - root - INFO - AL mask: 0 / 150. 
2025-07-12 15:58:23,223 - root - INFO - Evaluating on current checkpoint ckp_15. 
2025-07-12 15:58:23,223 - root - INFO - Gathering samples from checkpoints: ['ckp_15']
2025-07-12 15:58:23,224 - root - INFO - Subset length: 42
2025-07-12 15:58:23,600 - root - INFO - Eval on current training checkpoint ckp_15: Number of samples: 42, acc: 0.8571, balanced acc: 0.8500, loss: 2.7476. 
2025-07-12 15:58:23,600 - root - INFO - Evaluating on next checkpoint ckp_16. 
2025-07-12 15:58:25,641 - root - INFO - Number of samples: 94, acc: 0.6915, balanced acc: 0.6979, loss: 2.7509. 
2025-07-12 15:58:25,642 - root - INFO - Saving predictions to /fs/scratch/PAS2099/mino/ICICLE/log_auto/pipeline/serengeti_serengeti_C11/zs/2025-07-12-15-57-52/bioclip2/full_text_head/2025-07-12-15-57-56/log. 
wandb:                                                                                
wandb: 
wandb: Run history:
wandb:          accuracy ▂▇▄▃▁▇█▇▅▅▇▇▇▇▆▃
wandb: balanced_accuracy ▂▇▄▃▁▇█▇▅▅▇▇▇▇▆▃
wandb: 
wandb: Run summary:
wandb:          accuracy 0.69149
wandb: balanced_accuracy 0.69792
wandb: 
wandb: 🚀 View run serengeti_serengeti_C11 | zs | 2025-07-12-15-57-52 | bioclip2 | full_text_head | 2025-07-12-15-57-56 at: https://wandb.ai/minodaze-the-ohio-state-university/ICICLE-Benchmark/runs/0ac2swni
wandb: ⭐️ View project at: https://wandb.ai/minodaze-the-ohio-state-university/ICICLE-Benchmark
wandb: Synced 5 W&B file(s), 0 media file(s), 0 artifact file(s) and 0 other file(s)
wandb: Find logs at: ./wandb/run-20250712_155757-0ac2swni/logs
2025-07-12 15:58:26,202 - root - INFO - Elapsed time: 29.28 seconds. 
/users/PAS2099/mino/miniconda3/envs/ICICLE/lib/python3.11/site-packages/timm/models/layers/__init__.py:48: FutureWarning: Importing from timm.models.layers is deprecated, please import via timm.layers
  warnings.warn(f"Importing from {__name__} is deprecated, please import via timm.layers", FutureWarning)
2025-07-12 15:58:32,653 - root - INFO - Saving to /fs/scratch/PAS2099/mino/ICICLE/log_auto/pipeline/serengeti_serengeti_C03/zs/2025-07-12-15-58-27/bioclip2/full_text_head/2025-07-12-15-58-32/log. 
wandb: Currently logged in as: minodaze (minodaze-the-ohio-state-university) to https://api.wandb.ai. Use `wandb login --relogin` to force relogin
wandb: Tracking run with wandb version 0.20.1
wandb: Run data is saved locally in /users/PAS2099/mino/ICICLE/wandb/run-20250712_155832-6vcsesgf
wandb: Run `wandb offline` to turn off syncing.
wandb: Syncing run serengeti_serengeti_C03 | zs | 2025-07-12-15-58-27 | bioclip2 | full_text_head | 2025-07-12-15-58-32
wandb: ⭐️ View project at https://wandb.ai/minodaze-the-ohio-state-university/ICICLE-Benchmark
wandb: 🚀 View run at https://wandb.ai/minodaze-the-ohio-state-university/ICICLE-Benchmark/runs/6vcsesgf
2025-07-12 15:58:33,583 - root - INFO - wandb logging is enabled.
2025-07-12 15:58:33,584 - root - INFO - {'accu_eval': False,
 'adapter_bottleneck': 64,
 'adapter_init': 'lora_kaiming',
 'adapter_scaler': 0.1,
 'al_config': {'method': 'none'},
 'attention_index': None,
 'attention_type': 'full',
 'bitfit': False,
 'block_index': None,
 'c': '/fs/scratch/PAS2099/mino/ICICLE/configs/generated_common/serengeti_serengeti_C03_upper_bound.yaml',
 'cl_config': {'method': 'none'},
 'common_config': {'model': 'bioclip2', 'train_data_config_path': '/fs/scratch/PAS2099/camera-trap-benchmark/serengeti/serengeti_C03/30/train.json', 'eval_data_config_path': '/fs/scratch/PAS2099/camera-trap-benchmark/serengeti/serengeti_C03/30/test.json', 'all_data_config_path': '/fs/scratch/PAS2099/camera-trap-benchmark/serengeti/serengeti_C03/30/train-all.json', 'train_batch_size': 32, 'eval_batch_size': 512, 'optimizer_name': 'AdamW', 'optimizer_params': {'lr': 2.5e-05, 'weight_decay': 0.0001}, 'chop_head': False, 'scheduler': 'CosineAnnealingLR', 'scheduler_params': {'T_max': 30, 'eta_min': 2.5e-06}},
 'convpass_bottleneck': 8,
 'convpass_init': 'lora_xavier',
 'convpass_scaler': 10,
 'convpass_xavier_init': False,
 'debug': False,
 'device': 'cuda',
 'difffit': False,
 'drop_path_rate': 0.0,
 'eval_only': False,
 'eval_per_epoch': False,
 'fact_dim': 8,
 'fact_scaler': 1.0,
 'fact_type': None,
 'ft_attn_ln': 'before',
 'ft_attn_mode': 'parallel',
 'ft_attn_module': None,
 'ft_mlp_ln': 'before',
 'ft_mlp_mode': 'parallel',
 'ft_mlp_module': None,
 'full': True,
 'generalization_test': 'a',
 'gpu_id': None,
 'gpu_memory_monitor': False,
 'interpolation_alpha': 0.5,
 'interpolation_head': False,
 'interpolation_model': False,
 'is_save': False,
 'label_type': 'common',
 'ln': False,
 'log_path': '/fs/scratch/PAS2099/mino/ICICLE/log_auto/pipeline/serengeti_serengeti_C03/zs/2025-07-12-15-58-27/',
 'lora_bottleneck': 0,
 'merge_factor': 1,
 'mlp_index': None,
 'mlp_type': 'full',
 'module_name': 'zs',
 'no_gpu_monitor_colors': False,
 'ood_config': {'method': 'none'},
 'pretrain_config': {'pretrain': False},
 'pretrained_weights': 'bioclip2',
 'repadapter_bottleneck': 8,
 'repadapter_group': 2,
 'repadapter_init': 'lora_xavier',
 'repadapter_scaler': 1,
 'save_dir': '/fs/scratch/PAS2099/mino/ICICLE/log_auto/pipeline/serengeti_serengeti_C03/zs/2025-07-12-15-58-27/bioclip2/full_text_head/2025-07-12-15-58-32/log',
 'seed': 9527,
 'ssf': False,
 'text': 'head',
 'text_template': 'openai',
 'vpt_dropout': 0.1,
 'vpt_layer': None,
 'vpt_mode': None,
 'vpt_num': 10,
 'vqt_dropout': 0.1,
 'vqt_num': 0,
 'wandb': True}
2025-07-12 15:58:33,598 - root - INFO - Using Bioclip-2 model. 
2025-07-12 15:58:33,598 - root - INFO - Loaded ViT-L-14 model config.
2025-07-12 15:58:35,516 - root - INFO - Loading pretrained ViT-L-14 weights (pretrained_weights/bioclip-2/open_clip_pytorch_model.bin).
2025-07-12 15:58:38,763 - root - INFO - Skipping pretraining... 
2025-07-12 15:58:38,804 - root - INFO - Checkpoint list, length: 20: 
2025-07-12 15:58:38,805 - root - INFO - 	ckp_1 
2025-07-12 15:58:38,805 - root - INFO - 	ckp_2 
2025-07-12 15:58:38,805 - root - INFO - 	ckp_3 
2025-07-12 15:58:38,805 - root - INFO - 	ckp_4 
2025-07-12 15:58:38,805 - root - INFO - 	ckp_5 
2025-07-12 15:58:38,805 - root - INFO - 	ckp_6 
2025-07-12 15:58:38,805 - root - INFO - 	ckp_7 
2025-07-12 15:58:38,805 - root - INFO - 	ckp_8 
2025-07-12 15:58:38,805 - root - INFO - 	ckp_9 
2025-07-12 15:58:38,805 - root - INFO - 	ckp_10 
2025-07-12 15:58:38,805 - root - INFO - 	ckp_11 
2025-07-12 15:58:38,805 - root - INFO - 	ckp_12 
2025-07-12 15:58:38,805 - root - INFO - 	ckp_13 
2025-07-12 15:58:38,805 - root - INFO - 	ckp_14 
2025-07-12 15:58:38,805 - root - INFO - 	ckp_15 
2025-07-12 15:58:38,805 - root - INFO - 	ckp_16 
2025-07-12 15:58:38,806 - root - INFO - 	ckp_17 
2025-07-12 15:58:38,806 - root - INFO - 	ckp_18 
2025-07-12 15:58:38,806 - root - INFO - 	ckp_19 
2025-07-12 15:58:38,806 - root - INFO - 	ckp_20 
2025-07-12 15:58:38,821 - root - INFO - Training on checkpoint ckp_1. 
2025-07-12 15:58:38,821 - root - INFO - Subset length: 0
2025-07-12 15:58:38,822 - root - INFO - Gathering samples from checkpoints: ['ckp_1']
2025-07-12 15:58:38,823 - root - INFO - Subset length: 75
2025-07-12 15:58:38,823 - root - INFO - Training dataset size: 0. 
2025-07-12 15:58:38,823 - root - INFO - Evaluation dataset size: 75. 
2025-07-12 15:58:38,824 - root - INFO - OOD mask: 0 / 0. 
2025-07-12 15:58:38,824 - root - INFO - AL mask: 0 / 0. 
2025-07-12 15:58:38,824 - root - INFO - Evaluating on next checkpoint ckp_1. 
2025-07-12 15:58:39,698 - root - INFO - Number of samples: 75, acc: 0.8133, balanced acc: 0.8026, loss: 2.4660. 
2025-07-12 15:58:39,698 - root - INFO - Saving predictions to /fs/scratch/PAS2099/mino/ICICLE/log_auto/pipeline/serengeti_serengeti_C03/zs/2025-07-12-15-58-27/bioclip2/full_text_head/2025-07-12-15-58-32/log. 
2025-07-12 15:58:39,699 - root - INFO - Training on checkpoint ckp_2. 
2025-07-12 15:58:39,699 - root - INFO - Gathering samples from checkpoints: ['ckp_1']
2025-07-12 15:58:39,702 - root - INFO - Subset length: 103
2025-07-12 15:58:39,702 - root - INFO - Gathering samples from checkpoints: ['ckp_2']
2025-07-12 15:58:39,703 - root - INFO - Subset length: 30
2025-07-12 15:58:39,703 - root - INFO - Training dataset size: 103. 
2025-07-12 15:58:39,703 - root - INFO - Evaluation dataset size: 30. 
2025-07-12 15:58:39,703 - root - INFO - OOD mask: 0 / 103. 
2025-07-12 15:58:39,703 - root - INFO - AL mask: 0 / 103. 
2025-07-12 15:58:39,703 - root - INFO - Evaluating on current checkpoint ckp_1. 
2025-07-12 15:58:39,703 - root - INFO - Gathering samples from checkpoints: ['ckp_1']
2025-07-12 15:58:39,705 - root - INFO - Subset length: 75
2025-07-12 15:58:40,226 - root - INFO - Eval on current training checkpoint ckp_1: Number of samples: 75, acc: 0.8133, balanced acc: 0.8026, loss: 2.4660. 
2025-07-12 15:58:40,226 - root - INFO - Evaluating on next checkpoint ckp_2. 
2025-07-12 15:58:40,770 - root - INFO - Number of samples: 30, acc: 0.8667, balanced acc: 0.8667, loss: 2.4714. 
2025-07-12 15:58:40,771 - root - INFO - Saving predictions to /fs/scratch/PAS2099/mino/ICICLE/log_auto/pipeline/serengeti_serengeti_C03/zs/2025-07-12-15-58-27/bioclip2/full_text_head/2025-07-12-15-58-32/log. 
2025-07-12 15:58:40,773 - root - INFO - Training on checkpoint ckp_3. 
2025-07-12 15:58:40,774 - root - INFO - Gathering samples from checkpoints: ['ckp_2']
2025-07-12 15:58:40,777 - root - INFO - Subset length: 142
2025-07-12 15:58:40,777 - root - INFO - Gathering samples from checkpoints: ['ckp_3']
2025-07-12 15:58:40,778 - root - INFO - Subset length: 30
2025-07-12 15:58:40,778 - root - INFO - Training dataset size: 142. 
2025-07-12 15:58:40,778 - root - INFO - Evaluation dataset size: 30. 
2025-07-12 15:58:40,778 - root - INFO - OOD mask: 0 / 142. 
2025-07-12 15:58:40,778 - root - INFO - AL mask: 0 / 142. 
2025-07-12 15:58:40,778 - root - INFO - Evaluating on current checkpoint ckp_2. 
2025-07-12 15:58:40,778 - root - INFO - Gathering samples from checkpoints: ['ckp_2']
2025-07-12 15:58:40,779 - root - INFO - Subset length: 30
2025-07-12 15:58:41,080 - root - INFO - Eval on current training checkpoint ckp_2: Number of samples: 30, acc: 0.8667, balanced acc: 0.8667, loss: 2.4714. 
2025-07-12 15:58:41,080 - root - INFO - Evaluating on next checkpoint ckp_3. 
2025-07-12 15:58:41,709 - root - INFO - Number of samples: 30, acc: 0.7667, balanced acc: 0.7667, loss: 2.4736. 
2025-07-12 15:58:41,710 - root - INFO - Saving predictions to /fs/scratch/PAS2099/mino/ICICLE/log_auto/pipeline/serengeti_serengeti_C03/zs/2025-07-12-15-58-27/bioclip2/full_text_head/2025-07-12-15-58-32/log. 
2025-07-12 15:58:41,710 - root - INFO - Training on checkpoint ckp_4. 
2025-07-12 15:58:41,710 - root - INFO - Gathering samples from checkpoints: ['ckp_3']
2025-07-12 15:58:41,716 - root - INFO - Subset length: 271
2025-07-12 15:58:41,716 - root - INFO - Gathering samples from checkpoints: ['ckp_4']
2025-07-12 15:58:41,718 - root - INFO - Subset length: 56
2025-07-12 15:58:41,718 - root - INFO - Training dataset size: 271. 
2025-07-12 15:58:41,718 - root - INFO - Evaluation dataset size: 56. 
2025-07-12 15:58:41,718 - root - INFO - OOD mask: 0 / 271. 
2025-07-12 15:58:41,718 - root - INFO - AL mask: 0 / 271. 
2025-07-12 15:58:41,718 - root - INFO - Evaluating on current checkpoint ckp_3. 
2025-07-12 15:58:41,718 - root - INFO - Gathering samples from checkpoints: ['ckp_3']
2025-07-12 15:58:41,719 - root - INFO - Subset length: 30
2025-07-12 15:58:42,054 - root - INFO - Eval on current training checkpoint ckp_3: Number of samples: 30, acc: 0.7667, balanced acc: 0.7667, loss: 2.4736. 
2025-07-12 15:58:42,054 - root - INFO - Evaluating on next checkpoint ckp_4. 
2025-07-12 15:58:43,125 - root - INFO - Number of samples: 56, acc: 0.9107, balanced acc: 0.9121, loss: 2.4755. 
2025-07-12 15:58:43,126 - root - INFO - Saving predictions to /fs/scratch/PAS2099/mino/ICICLE/log_auto/pipeline/serengeti_serengeti_C03/zs/2025-07-12-15-58-27/bioclip2/full_text_head/2025-07-12-15-58-32/log. 
2025-07-12 15:58:43,128 - root - INFO - Training on checkpoint ckp_5. 
2025-07-12 15:58:43,128 - root - INFO - Gathering samples from checkpoints: ['ckp_4']
2025-07-12 15:58:43,298 - root - INFO - Subset length: 1804
2025-07-12 15:58:43,299 - root - INFO - Gathering samples from checkpoints: ['ckp_5']
2025-07-12 15:58:43,300 - root - INFO - Subset length: 53
2025-07-12 15:58:43,300 - root - INFO - Training dataset size: 1804. 
2025-07-12 15:58:43,300 - root - INFO - Evaluation dataset size: 53. 
2025-07-12 15:58:43,300 - root - INFO - OOD mask: 0 / 1804. 
2025-07-12 15:58:43,300 - root - INFO - AL mask: 0 / 1804. 
2025-07-12 15:58:43,300 - root - INFO - Evaluating on current checkpoint ckp_4. 
2025-07-12 15:58:43,301 - root - INFO - Gathering samples from checkpoints: ['ckp_4']
2025-07-12 15:58:43,302 - root - INFO - Subset length: 56
2025-07-12 15:58:43,878 - root - INFO - Eval on current training checkpoint ckp_4: Number of samples: 56, acc: 0.9107, balanced acc: 0.9121, loss: 2.4755. 
2025-07-12 15:58:43,878 - root - INFO - Evaluating on next checkpoint ckp_5. 
2025-07-12 15:58:44,968 - root - INFO - Number of samples: 53, acc: 0.9057, balanced acc: 0.9000, loss: 2.4597. 
2025-07-12 15:58:44,969 - root - INFO - Saving predictions to /fs/scratch/PAS2099/mino/ICICLE/log_auto/pipeline/serengeti_serengeti_C03/zs/2025-07-12-15-58-27/bioclip2/full_text_head/2025-07-12-15-58-32/log. 
2025-07-12 15:58:44,970 - root - INFO - Training on checkpoint ckp_6. 
2025-07-12 15:58:44,970 - root - INFO - Gathering samples from checkpoints: ['ckp_5']
2025-07-12 15:58:44,973 - root - INFO - Subset length: 121
2025-07-12 15:58:44,974 - root - INFO - Gathering samples from checkpoints: ['ckp_6']
2025-07-12 15:58:44,976 - root - INFO - Subset length: 69
2025-07-12 15:58:44,976 - root - INFO - Training dataset size: 121. 
2025-07-12 15:58:44,976 - root - INFO - Evaluation dataset size: 69. 
2025-07-12 15:58:44,976 - root - INFO - OOD mask: 0 / 121. 
2025-07-12 15:58:44,976 - root - INFO - AL mask: 0 / 121. 
2025-07-12 15:58:44,976 - root - INFO - Evaluating on current checkpoint ckp_5. 
2025-07-12 15:58:44,976 - root - INFO - Gathering samples from checkpoints: ['ckp_5']
2025-07-12 15:58:44,977 - root - INFO - Subset length: 53
2025-07-12 15:58:45,532 - root - INFO - Eval on current training checkpoint ckp_5: Number of samples: 53, acc: 0.9057, balanced acc: 0.9000, loss: 2.4597. 
2025-07-12 15:58:45,532 - root - INFO - Evaluating on next checkpoint ckp_6. 
2025-07-12 15:58:46,826 - root - INFO - Number of samples: 69, acc: 0.8841, balanced acc: 0.8864, loss: 2.4749. 
2025-07-12 15:58:46,827 - root - INFO - Saving predictions to /fs/scratch/PAS2099/mino/ICICLE/log_auto/pipeline/serengeti_serengeti_C03/zs/2025-07-12-15-58-27/bioclip2/full_text_head/2025-07-12-15-58-32/log. 
2025-07-12 15:58:46,828 - root - INFO - Training on checkpoint ckp_7. 
2025-07-12 15:58:46,828 - root - INFO - Gathering samples from checkpoints: ['ckp_6']
2025-07-12 15:58:46,831 - root - INFO - Subset length: 114
2025-07-12 15:58:46,831 - root - INFO - Gathering samples from checkpoints: ['ckp_7']
2025-07-12 15:58:46,832 - root - INFO - Subset length: 34
2025-07-12 15:58:46,832 - root - INFO - Training dataset size: 114. 
2025-07-12 15:58:46,832 - root - INFO - Evaluation dataset size: 34. 
2025-07-12 15:58:46,833 - root - INFO - OOD mask: 0 / 114. 
2025-07-12 15:58:46,833 - root - INFO - AL mask: 0 / 114. 
2025-07-12 15:58:46,833 - root - INFO - Evaluating on current checkpoint ckp_6. 
2025-07-12 15:58:46,833 - root - INFO - Gathering samples from checkpoints: ['ckp_6']
2025-07-12 15:58:46,834 - root - INFO - Subset length: 69
2025-07-12 15:58:47,553 - root - INFO - Eval on current training checkpoint ckp_6: Number of samples: 69, acc: 0.8841, balanced acc: 0.8864, loss: 2.4749. 
2025-07-12 15:58:47,554 - root - INFO - Evaluating on next checkpoint ckp_7. 
2025-07-12 15:58:48,080 - root - INFO - Number of samples: 34, acc: 0.9118, balanced acc: 0.9111, loss: 2.4723. 
2025-07-12 15:58:48,080 - root - INFO - Saving predictions to /fs/scratch/PAS2099/mino/ICICLE/log_auto/pipeline/serengeti_serengeti_C03/zs/2025-07-12-15-58-27/bioclip2/full_text_head/2025-07-12-15-58-32/log. 
2025-07-12 15:58:48,081 - root - INFO - Training on checkpoint ckp_8. 
2025-07-12 15:58:48,081 - root - INFO - Gathering samples from checkpoints: ['ckp_7']
2025-07-12 15:58:48,085 - root - INFO - Subset length: 131
2025-07-12 15:58:48,085 - root - INFO - Gathering samples from checkpoints: ['ckp_8']
2025-07-12 15:58:48,086 - root - INFO - Subset length: 43
2025-07-12 15:58:48,086 - root - INFO - Training dataset size: 131. 
2025-07-12 15:58:48,086 - root - INFO - Evaluation dataset size: 43. 
2025-07-12 15:58:48,086 - root - INFO - OOD mask: 0 / 131. 
2025-07-12 15:58:48,086 - root - INFO - AL mask: 0 / 131. 
2025-07-12 15:58:48,086 - root - INFO - Evaluating on current checkpoint ckp_7. 
2025-07-12 15:58:48,086 - root - INFO - Gathering samples from checkpoints: ['ckp_7']
2025-07-12 15:58:48,087 - root - INFO - Subset length: 34
2025-07-12 15:58:48,389 - root - INFO - Eval on current training checkpoint ckp_7: Number of samples: 34, acc: 0.9118, balanced acc: 0.9111, loss: 2.4723. 
2025-07-12 15:58:48,389 - root - INFO - Evaluating on next checkpoint ckp_8. 
2025-07-12 15:58:49,045 - root - INFO - Number of samples: 43, acc: 0.9535, balanced acc: 0.9523, loss: 2.4797. 
2025-07-12 15:58:49,045 - root - INFO - Saving predictions to /fs/scratch/PAS2099/mino/ICICLE/log_auto/pipeline/serengeti_serengeti_C03/zs/2025-07-12-15-58-27/bioclip2/full_text_head/2025-07-12-15-58-32/log. 
2025-07-12 15:58:49,046 - root - INFO - Training on checkpoint ckp_9. 
2025-07-12 15:58:49,046 - root - INFO - Gathering samples from checkpoints: ['ckp_8']
2025-07-12 15:58:49,049 - root - INFO - Subset length: 120
2025-07-12 15:58:49,049 - root - INFO - Gathering samples from checkpoints: ['ckp_9']
2025-07-12 15:58:49,050 - root - INFO - Subset length: 65
2025-07-12 15:58:49,050 - root - INFO - Training dataset size: 120. 
2025-07-12 15:58:49,051 - root - INFO - Evaluation dataset size: 65. 
2025-07-12 15:58:49,051 - root - INFO - OOD mask: 0 / 120. 
2025-07-12 15:58:49,051 - root - INFO - AL mask: 0 / 120. 
2025-07-12 15:58:49,051 - root - INFO - Evaluating on current checkpoint ckp_8. 
2025-07-12 15:58:49,051 - root - INFO - Gathering samples from checkpoints: ['ckp_8']
2025-07-12 15:58:49,052 - root - INFO - Subset length: 43
2025-07-12 15:58:49,420 - root - INFO - Eval on current training checkpoint ckp_8: Number of samples: 43, acc: 0.9535, balanced acc: 0.9523, loss: 2.4797. 
2025-07-12 15:58:49,420 - root - INFO - Evaluating on next checkpoint ckp_9. 
2025-07-12 15:58:50,308 - root - INFO - Number of samples: 65, acc: 0.8000, balanced acc: 0.8035, loss: 2.4810. 
2025-07-12 15:58:50,308 - root - INFO - Saving predictions to /fs/scratch/PAS2099/mino/ICICLE/log_auto/pipeline/serengeti_serengeti_C03/zs/2025-07-12-15-58-27/bioclip2/full_text_head/2025-07-12-15-58-32/log. 
2025-07-12 15:58:50,310 - root - INFO - Training on checkpoint ckp_10. 
2025-07-12 15:58:50,310 - root - INFO - Gathering samples from checkpoints: ['ckp_9']
2025-07-12 15:58:50,312 - root - INFO - Subset length: 98
2025-07-12 15:58:50,313 - root - INFO - Gathering samples from checkpoints: ['ckp_10']
2025-07-12 15:58:50,314 - root - INFO - Subset length: 44
2025-07-12 15:58:50,314 - root - INFO - Training dataset size: 98. 
2025-07-12 15:58:50,314 - root - INFO - Evaluation dataset size: 44. 
2025-07-12 15:58:50,314 - root - INFO - OOD mask: 0 / 98. 
2025-07-12 15:58:50,314 - root - INFO - AL mask: 0 / 98. 
2025-07-12 15:58:50,314 - root - INFO - Evaluating on current checkpoint ckp_9. 
2025-07-12 15:58:50,314 - root - INFO - Gathering samples from checkpoints: ['ckp_9']
2025-07-12 15:58:50,316 - root - INFO - Subset length: 65
2025-07-12 15:58:50,808 - root - INFO - Eval on current training checkpoint ckp_9: Number of samples: 65, acc: 0.8000, balanced acc: 0.8035, loss: 2.4810. 
2025-07-12 15:58:50,808 - root - INFO - Evaluating on next checkpoint ckp_10. 
2025-07-12 15:58:51,592 - root - INFO - Number of samples: 44, acc: 0.8409, balanced acc: 0.8485, loss: 2.4776. 
2025-07-12 15:58:51,592 - root - INFO - Saving predictions to /fs/scratch/PAS2099/mino/ICICLE/log_auto/pipeline/serengeti_serengeti_C03/zs/2025-07-12-15-58-27/bioclip2/full_text_head/2025-07-12-15-58-32/log. 
2025-07-12 15:58:51,593 - root - INFO - Training on checkpoint ckp_11. 
2025-07-12 15:58:51,593 - root - INFO - Gathering samples from checkpoints: ['ckp_10']
2025-07-12 15:58:51,597 - root - INFO - Subset length: 140
2025-07-12 15:58:51,597 - root - INFO - Gathering samples from checkpoints: ['ckp_11']
2025-07-12 15:58:51,598 - root - INFO - Subset length: 32
2025-07-12 15:58:51,598 - root - INFO - Training dataset size: 140. 
2025-07-12 15:58:51,598 - root - INFO - Evaluation dataset size: 32. 
2025-07-12 15:58:51,598 - root - INFO - OOD mask: 0 / 140. 
2025-07-12 15:58:51,598 - root - INFO - AL mask: 0 / 140. 
2025-07-12 15:58:51,598 - root - INFO - Evaluating on current checkpoint ckp_10. 
2025-07-12 15:58:51,598 - root - INFO - Gathering samples from checkpoints: ['ckp_10']
2025-07-12 15:58:51,599 - root - INFO - Subset length: 44
2025-07-12 15:58:52,008 - root - INFO - Eval on current training checkpoint ckp_10: Number of samples: 44, acc: 0.8409, balanced acc: 0.8485, loss: 2.4776. 
2025-07-12 15:58:52,009 - root - INFO - Evaluating on next checkpoint ckp_11. 
2025-07-12 15:58:52,703 - root - INFO - Number of samples: 32, acc: 0.6875, balanced acc: 0.6848, loss: 2.4928. 
2025-07-12 15:58:52,703 - root - INFO - Saving predictions to /fs/scratch/PAS2099/mino/ICICLE/log_auto/pipeline/serengeti_serengeti_C03/zs/2025-07-12-15-58-27/bioclip2/full_text_head/2025-07-12-15-58-32/log. 
2025-07-12 15:58:52,704 - root - INFO - Training on checkpoint ckp_12. 
2025-07-12 15:58:52,704 - root - INFO - Gathering samples from checkpoints: ['ckp_11']
2025-07-12 15:58:52,721 - root - INFO - Subset length: 811
2025-07-12 15:58:52,721 - root - INFO - Gathering samples from checkpoints: ['ckp_12']
2025-07-12 15:58:52,722 - root - INFO - Subset length: 57
2025-07-12 15:58:52,722 - root - INFO - Training dataset size: 811. 
2025-07-12 15:58:52,722 - root - INFO - Evaluation dataset size: 57. 
2025-07-12 15:58:52,722 - root - INFO - OOD mask: 0 / 811. 
2025-07-12 15:58:52,723 - root - INFO - AL mask: 0 / 811. 
2025-07-12 15:58:52,723 - root - INFO - Evaluating on current checkpoint ckp_11. 
2025-07-12 15:58:52,723 - root - INFO - Gathering samples from checkpoints: ['ckp_11']
2025-07-12 15:58:52,723 - root - INFO - Subset length: 32
2025-07-12 15:58:53,067 - root - INFO - Eval on current training checkpoint ckp_11: Number of samples: 32, acc: 0.6875, balanced acc: 0.6848, loss: 2.4928. 
2025-07-12 15:58:53,068 - root - INFO - Evaluating on next checkpoint ckp_12. 
2025-07-12 15:58:54,132 - root - INFO - Number of samples: 57, acc: 0.9123, balanced acc: 0.9167, loss: 2.4674. 
2025-07-12 15:58:54,132 - root - INFO - Saving predictions to /fs/scratch/PAS2099/mino/ICICLE/log_auto/pipeline/serengeti_serengeti_C03/zs/2025-07-12-15-58-27/bioclip2/full_text_head/2025-07-12-15-58-32/log. 
2025-07-12 15:58:54,133 - root - INFO - Training on checkpoint ckp_13. 
2025-07-12 15:58:54,133 - root - INFO - Gathering samples from checkpoints: ['ckp_12']
2025-07-12 15:58:54,136 - root - INFO - Subset length: 130
2025-07-12 15:58:54,137 - root - INFO - Gathering samples from checkpoints: ['ckp_13']
2025-07-12 15:58:54,138 - root - INFO - Subset length: 42
2025-07-12 15:58:54,138 - root - INFO - Training dataset size: 130. 
2025-07-12 15:58:54,138 - root - INFO - Evaluation dataset size: 42. 
2025-07-12 15:58:54,138 - root - INFO - OOD mask: 0 / 130. 
2025-07-12 15:58:54,138 - root - INFO - AL mask: 0 / 130. 
2025-07-12 15:58:54,138 - root - INFO - Evaluating on current checkpoint ckp_12. 
2025-07-12 15:58:54,138 - root - INFO - Gathering samples from checkpoints: ['ckp_12']
2025-07-12 15:58:54,140 - root - INFO - Subset length: 57
2025-07-12 15:58:54,721 - root - INFO - Eval on current training checkpoint ckp_12: Number of samples: 57, acc: 0.9123, balanced acc: 0.9167, loss: 2.4674. 
2025-07-12 15:58:54,722 - root - INFO - Evaluating on next checkpoint ckp_13. 
2025-07-12 15:58:55,500 - root - INFO - Number of samples: 42, acc: 0.8810, balanced acc: 0.8750, loss: 2.4774. 
2025-07-12 15:58:55,500 - root - INFO - Saving predictions to /fs/scratch/PAS2099/mino/ICICLE/log_auto/pipeline/serengeti_serengeti_C03/zs/2025-07-12-15-58-27/bioclip2/full_text_head/2025-07-12-15-58-32/log. 
2025-07-12 15:58:55,501 - root - INFO - Training on checkpoint ckp_14. 
2025-07-12 15:58:55,501 - root - INFO - Gathering samples from checkpoints: ['ckp_13']
2025-07-12 15:58:55,504 - root - INFO - Subset length: 146
2025-07-12 15:58:55,505 - root - INFO - Gathering samples from checkpoints: ['ckp_14']
2025-07-12 15:58:55,505 - root - INFO - Subset length: 30
2025-07-12 15:58:55,505 - root - INFO - Training dataset size: 146. 
2025-07-12 15:58:55,505 - root - INFO - Evaluation dataset size: 30. 
2025-07-12 15:58:55,506 - root - INFO - OOD mask: 0 / 146. 
2025-07-12 15:58:55,506 - root - INFO - AL mask: 0 / 146. 
2025-07-12 15:58:55,506 - root - INFO - Evaluating on current checkpoint ckp_13. 
2025-07-12 15:58:55,506 - root - INFO - Gathering samples from checkpoints: ['ckp_13']
2025-07-12 15:58:55,507 - root - INFO - Subset length: 42
2025-07-12 15:58:55,921 - root - INFO - Eval on current training checkpoint ckp_13: Number of samples: 42, acc: 0.8810, balanced acc: 0.8750, loss: 2.4774. 
2025-07-12 15:58:55,921 - root - INFO - Evaluating on next checkpoint ckp_14. 
2025-07-12 15:58:56,550 - root - INFO - Number of samples: 30, acc: 0.8333, balanced acc: 0.8333, loss: 2.4736. 
2025-07-12 15:58:56,550 - root - INFO - Saving predictions to /fs/scratch/PAS2099/mino/ICICLE/log_auto/pipeline/serengeti_serengeti_C03/zs/2025-07-12-15-58-27/bioclip2/full_text_head/2025-07-12-15-58-32/log. 
2025-07-12 15:58:56,551 - root - INFO - Training on checkpoint ckp_15. 
2025-07-12 15:58:56,551 - root - INFO - Gathering samples from checkpoints: ['ckp_14']
2025-07-12 15:58:56,557 - root - INFO - Subset length: 268
2025-07-12 15:58:56,557 - root - INFO - Gathering samples from checkpoints: ['ckp_15']
2025-07-12 15:58:56,558 - root - INFO - Subset length: 55
2025-07-12 15:58:56,559 - root - INFO - Training dataset size: 268. 
2025-07-12 15:58:56,559 - root - INFO - Evaluation dataset size: 55. 
2025-07-12 15:58:56,559 - root - INFO - OOD mask: 0 / 268. 
2025-07-12 15:58:56,559 - root - INFO - AL mask: 0 / 268. 
2025-07-12 15:58:56,559 - root - INFO - Evaluating on current checkpoint ckp_14. 
2025-07-12 15:58:56,559 - root - INFO - Gathering samples from checkpoints: ['ckp_14']
2025-07-12 15:58:56,560 - root - INFO - Subset length: 30
2025-07-12 15:58:56,887 - root - INFO - Eval on current training checkpoint ckp_14: Number of samples: 30, acc: 0.8333, balanced acc: 0.8333, loss: 2.4736. 
2025-07-12 15:58:56,887 - root - INFO - Evaluating on next checkpoint ckp_15. 
2025-07-12 15:58:57,945 - root - INFO - Number of samples: 55, acc: 0.8000, balanced acc: 0.8106, loss: 2.4826. 
2025-07-12 15:58:57,945 - root - INFO - Saving predictions to /fs/scratch/PAS2099/mino/ICICLE/log_auto/pipeline/serengeti_serengeti_C03/zs/2025-07-12-15-58-27/bioclip2/full_text_head/2025-07-12-15-58-32/log. 
2025-07-12 15:58:57,947 - root - INFO - Training on checkpoint ckp_16. 
2025-07-12 15:58:57,947 - root - INFO - Gathering samples from checkpoints: ['ckp_15']
2025-07-12 15:58:57,950 - root - INFO - Subset length: 142
2025-07-12 15:58:57,951 - root - INFO - Gathering samples from checkpoints: ['ckp_16']
2025-07-12 15:58:57,952 - root - INFO - Subset length: 54
2025-07-12 15:58:57,952 - root - INFO - Training dataset size: 142. 
2025-07-12 15:58:57,952 - root - INFO - Evaluation dataset size: 54. 
2025-07-12 15:58:57,952 - root - INFO - OOD mask: 0 / 142. 
2025-07-12 15:58:57,952 - root - INFO - AL mask: 0 / 142. 
2025-07-12 15:58:57,952 - root - INFO - Evaluating on current checkpoint ckp_15. 
2025-07-12 15:58:57,952 - root - INFO - Gathering samples from checkpoints: ['ckp_15']
2025-07-12 15:58:57,953 - root - INFO - Subset length: 55
2025-07-12 15:58:58,528 - root - INFO - Eval on current training checkpoint ckp_15: Number of samples: 55, acc: 0.8000, balanced acc: 0.8106, loss: 2.4826. 
2025-07-12 15:58:58,529 - root - INFO - Evaluating on next checkpoint ckp_16. 
2025-07-12 15:58:59,500 - root - INFO - Number of samples: 54, acc: 0.8889, balanced acc: 0.8800, loss: 2.4744. 
2025-07-12 15:58:59,501 - root - INFO - Saving predictions to /fs/scratch/PAS2099/mino/ICICLE/log_auto/pipeline/serengeti_serengeti_C03/zs/2025-07-12-15-58-27/bioclip2/full_text_head/2025-07-12-15-58-32/log. 
2025-07-12 15:58:59,502 - root - INFO - Training on checkpoint ckp_17. 
2025-07-12 15:58:59,502 - root - INFO - Gathering samples from checkpoints: ['ckp_16']
2025-07-12 15:58:59,505 - root - INFO - Subset length: 128
2025-07-12 15:58:59,506 - root - INFO - Gathering samples from checkpoints: ['ckp_17']
2025-07-12 15:58:59,506 - root - INFO - Subset length: 33
2025-07-12 15:58:59,507 - root - INFO - Training dataset size: 128. 
2025-07-12 15:58:59,507 - root - INFO - Evaluation dataset size: 33. 
2025-07-12 15:58:59,507 - root - INFO - OOD mask: 0 / 128. 
2025-07-12 15:58:59,507 - root - INFO - AL mask: 0 / 128. 
2025-07-12 15:58:59,507 - root - INFO - Evaluating on current checkpoint ckp_16. 
2025-07-12 15:58:59,507 - root - INFO - Gathering samples from checkpoints: ['ckp_16']
2025-07-12 15:58:59,508 - root - INFO - Subset length: 54
2025-07-12 15:59:00,030 - root - INFO - Eval on current training checkpoint ckp_16: Number of samples: 54, acc: 0.8889, balanced acc: 0.8800, loss: 2.4744. 
2025-07-12 15:59:00,031 - root - INFO - Evaluating on next checkpoint ckp_17. 
2025-07-12 15:59:00,807 - root - INFO - Number of samples: 33, acc: 0.9394, balanced acc: 0.9444, loss: 2.4705. 
2025-07-12 15:59:00,808 - root - INFO - Saving predictions to /fs/scratch/PAS2099/mino/ICICLE/log_auto/pipeline/serengeti_serengeti_C03/zs/2025-07-12-15-58-27/bioclip2/full_text_head/2025-07-12-15-58-32/log. 
2025-07-12 15:59:00,809 - root - INFO - Training on checkpoint ckp_18. 
2025-07-12 15:59:00,810 - root - INFO - Gathering samples from checkpoints: ['ckp_17']
2025-07-12 15:59:00,813 - root - INFO - Subset length: 181
2025-07-12 15:59:00,814 - root - INFO - Gathering samples from checkpoints: ['ckp_18']
2025-07-12 15:59:00,815 - root - INFO - Subset length: 53
2025-07-12 15:59:00,815 - root - INFO - Training dataset size: 181. 
2025-07-12 15:59:00,815 - root - INFO - Evaluation dataset size: 53. 
2025-07-12 15:59:00,815 - root - INFO - OOD mask: 0 / 181. 
2025-07-12 15:59:00,815 - root - INFO - AL mask: 0 / 181. 
2025-07-12 15:59:00,815 - root - INFO - Evaluating on current checkpoint ckp_17. 
2025-07-12 15:59:00,815 - root - INFO - Gathering samples from checkpoints: ['ckp_17']
2025-07-12 15:59:00,816 - root - INFO - Subset length: 33
2025-07-12 15:59:01,238 - root - INFO - Eval on current training checkpoint ckp_17: Number of samples: 33, acc: 0.9394, balanced acc: 0.9444, loss: 2.4705. 
2025-07-12 15:59:01,239 - root - INFO - Evaluating on next checkpoint ckp_18. 
2025-07-12 15:59:02,396 - root - INFO - Number of samples: 53, acc: 0.8868, balanced acc: 0.8933, loss: 2.4779. 
2025-07-12 15:59:02,396 - root - INFO - Saving predictions to /fs/scratch/PAS2099/mino/ICICLE/log_auto/pipeline/serengeti_serengeti_C03/zs/2025-07-12-15-58-27/bioclip2/full_text_head/2025-07-12-15-58-32/log. 
2025-07-12 15:59:02,397 - root - INFO - Training on checkpoint ckp_19. 
2025-07-12 15:59:02,397 - root - INFO - Gathering samples from checkpoints: ['ckp_18']
2025-07-12 15:59:02,400 - root - INFO - Subset length: 145
2025-07-12 15:59:02,401 - root - INFO - Gathering samples from checkpoints: ['ckp_19']
2025-07-12 15:59:02,402 - root - INFO - Subset length: 55
2025-07-12 15:59:02,402 - root - INFO - Training dataset size: 145. 
2025-07-12 15:59:02,402 - root - INFO - Evaluation dataset size: 55. 
2025-07-12 15:59:02,402 - root - INFO - OOD mask: 0 / 145. 
2025-07-12 15:59:02,402 - root - INFO - AL mask: 0 / 145. 
2025-07-12 15:59:02,402 - root - INFO - Evaluating on current checkpoint ckp_18. 
2025-07-12 15:59:02,402 - root - INFO - Gathering samples from checkpoints: ['ckp_18']
2025-07-12 15:59:02,404 - root - INFO - Subset length: 53
2025-07-12 15:59:03,009 - root - INFO - Eval on current training checkpoint ckp_18: Number of samples: 53, acc: 0.8868, balanced acc: 0.8933, loss: 2.4779. 
2025-07-12 15:59:03,009 - root - INFO - Evaluating on next checkpoint ckp_19. 
2025-07-12 15:59:04,122 - root - INFO - Number of samples: 55, acc: 0.8545, balanced acc: 0.8603, loss: 2.4869. 
2025-07-12 15:59:04,122 - root - INFO - Saving predictions to /fs/scratch/PAS2099/mino/ICICLE/log_auto/pipeline/serengeti_serengeti_C03/zs/2025-07-12-15-58-27/bioclip2/full_text_head/2025-07-12-15-58-32/log. 
2025-07-12 15:59:04,123 - root - INFO - Training on checkpoint ckp_20. 
2025-07-12 15:59:04,123 - root - INFO - Gathering samples from checkpoints: ['ckp_19']
2025-07-12 15:59:04,129 - root - INFO - Subset length: 217
2025-07-12 15:59:04,129 - root - INFO - Gathering samples from checkpoints: ['ckp_20']
2025-07-12 15:59:04,129 - root - INFO - Subset length: 31
2025-07-12 15:59:04,130 - root - INFO - Training dataset size: 217. 
2025-07-12 15:59:04,130 - root - INFO - Evaluation dataset size: 31. 
2025-07-12 15:59:04,130 - root - INFO - OOD mask: 0 / 217. 
2025-07-12 15:59:04,130 - root - INFO - AL mask: 0 / 217. 
2025-07-12 15:59:04,130 - root - INFO - Evaluating on current checkpoint ckp_19. 
2025-07-12 15:59:04,130 - root - INFO - Gathering samples from checkpoints: ['ckp_19']
2025-07-12 15:59:04,131 - root - INFO - Subset length: 55
2025-07-12 15:59:04,738 - root - INFO - Eval on current training checkpoint ckp_19: Number of samples: 55, acc: 0.8545, balanced acc: 0.8603, loss: 2.4869. 
2025-07-12 15:59:04,738 - root - INFO - Evaluating on next checkpoint ckp_20. 
2025-07-12 15:59:05,407 - root - INFO - Number of samples: 31, acc: 0.9355, balanced acc: 0.9364, loss: 2.4600. 
2025-07-12 15:59:05,408 - root - INFO - Saving predictions to /fs/scratch/PAS2099/mino/ICICLE/log_auto/pipeline/serengeti_serengeti_C03/zs/2025-07-12-15-58-27/bioclip2/full_text_head/2025-07-12-15-58-32/log. 
wandb:                                                                                
wandb: 
wandb: Run history:
wandb:          accuracy ▄▆▃▇▇▆▇█▄▅▁▇▆▅▄▆█▆▅█
wandb: balanced_accuracy ▄▆▃▇▇▆▇█▄▅▁▇▆▅▄▆█▆▆█
wandb: 
wandb: Run summary:
wandb:          accuracy 0.93548
wandb: balanced_accuracy 0.93636
wandb: 
wandb: 🚀 View run serengeti_serengeti_C03 | zs | 2025-07-12-15-58-27 | bioclip2 | full_text_head | 2025-07-12-15-58-32 at: https://wandb.ai/minodaze-the-ohio-state-university/ICICLE-Benchmark/runs/6vcsesgf
wandb: ⭐️ View project at: https://wandb.ai/minodaze-the-ohio-state-university/ICICLE-Benchmark
wandb: Synced 5 W&B file(s), 0 media file(s), 0 artifact file(s) and 0 other file(s)
wandb: Find logs at: ./wandb/run-20250712_155832-6vcsesgf/logs
2025-07-12 15:59:05,997 - root - INFO - Elapsed time: 33.34 seconds. 
