/users/PAS2099/mino/miniconda3/envs/ICICLE/lib/python3.11/site-packages/timm/models/layers/__init__.py:48: FutureWarning: Importing from timm.models.layers is deprecated, please import via timm.layers
  warnings.warn(f"Importing from {__name__} is deprecated, please import via timm.layers", FutureWarning)
2025-07-12 15:51:55,475 - root - INFO - Saving to /fs/scratch/PAS2099/mino/ICICLE/log_auto/pipeline/serengeti_serengeti_M10/upper_bound/2025-07-12-15-51-50/bioclip2/full_text_head/2025-07-12-15-51-55/log. 
wandb: Currently logged in as: minodaze (minodaze-the-ohio-state-university) to https://api.wandb.ai. Use `wandb login --relogin` to force relogin
wandb: Tracking run with wandb version 0.20.1
wandb: Run data is saved locally in /users/PAS2099/mino/ICICLE/wandb/run-20250712_155155-m7l7dlk4
wandb: Run `wandb offline` to turn off syncing.
wandb: Syncing run serengeti_serengeti_M10 | upper_bound | 2025-07-12-15-51-50 | bioclip2 | full_text_head | 2025-07-12-15-51-55
wandb: ⭐️ View project at https://wandb.ai/minodaze-the-ohio-state-university/ICICLE-Benchmark
wandb: 🚀 View run at https://wandb.ai/minodaze-the-ohio-state-university/ICICLE-Benchmark/runs/m7l7dlk4
2025-07-12 15:51:56,467 - root - INFO - wandb logging is enabled.
2025-07-12 15:51:56,468 - root - INFO - {'accu_eval': False,
 'adapter_bottleneck': 64,
 'adapter_init': 'lora_kaiming',
 'adapter_scaler': 0.1,
 'al_config': {'method': 'none'},
 'attention_index': None,
 'attention_type': 'full',
 'bitfit': False,
 'block_index': None,
 'c': '/fs/scratch/PAS2099/mino/ICICLE/configs/generated_common/serengeti_serengeti_M10_upper_bound.yaml',
 'cl_config': {'method': 'none'},
 'common_config': {'model': 'bioclip2', 'train_data_config_path': '/fs/scratch/PAS2099/camera-trap-benchmark/serengeti/serengeti_M10/30/train.json', 'eval_data_config_path': '/fs/scratch/PAS2099/camera-trap-benchmark/serengeti/serengeti_M10/30/test.json', 'all_data_config_path': '/fs/scratch/PAS2099/camera-trap-benchmark/serengeti/serengeti_M10/30/train-all.json', 'train_batch_size': 32, 'eval_batch_size': 512, 'optimizer_name': 'AdamW', 'optimizer_params': {'lr': 2.5e-05, 'weight_decay': 0.0001}, 'chop_head': False, 'scheduler': 'CosineAnnealingLR', 'scheduler_params': {'T_max': 30, 'eta_min': 2.5e-06}},
 'convpass_bottleneck': 8,
 'convpass_init': 'lora_xavier',
 'convpass_scaler': 10,
 'convpass_xavier_init': False,
 'debug': False,
 'device': 'cuda',
 'difffit': False,
 'drop_path_rate': 0.0,
 'eval_only': False,
 'eval_per_epoch': False,
 'fact_dim': 8,
 'fact_scaler': 1.0,
 'fact_type': None,
 'ft_attn_ln': 'before',
 'ft_attn_mode': 'parallel',
 'ft_attn_module': None,
 'ft_mlp_ln': 'before',
 'ft_mlp_mode': 'parallel',
 'ft_mlp_module': None,
 'full': True,
 'generalization_test': 'a',
 'gpu_id': None,
 'gpu_memory_monitor': False,
 'interpolation_alpha': 0.5,
 'interpolation_head': False,
 'interpolation_model': False,
 'is_save': False,
 'label_type': 'common',
 'ln': False,
 'log_path': '/fs/scratch/PAS2099/mino/ICICLE/log_auto/pipeline/serengeti_serengeti_M10/upper_bound/2025-07-12-15-51-50/',
 'lora_bottleneck': 0,
 'merge_factor': 1,
 'mlp_index': None,
 'mlp_type': 'full',
 'module_name': 'upper_bound',
 'no_gpu_monitor_colors': False,
 'ood_config': {'method': 'none'},
 'pretrain_config': {'pretrain': False},
 'pretrained_weights': 'bioclip2',
 'repadapter_bottleneck': 8,
 'repadapter_group': 2,
 'repadapter_init': 'lora_xavier',
 'repadapter_scaler': 1,
 'save_dir': '/fs/scratch/PAS2099/mino/ICICLE/log_auto/pipeline/serengeti_serengeti_M10/upper_bound/2025-07-12-15-51-50/bioclip2/full_text_head/2025-07-12-15-51-55/log',
 'seed': 9527,
 'ssf': False,
 'text': 'head',
 'text_template': 'openai',
 'vpt_dropout': 0.1,
 'vpt_layer': None,
 'vpt_mode': None,
 'vpt_num': 10,
 'vqt_dropout': 0.1,
 'vqt_num': 0,
 'wandb': True}
2025-07-12 15:51:56,470 - root - INFO - Using Bioclip-2 model. 
2025-07-12 15:51:56,470 - root - INFO - Loaded ViT-L-14 model config.
2025-07-12 15:51:58,383 - root - INFO - Loading pretrained ViT-L-14 weights (pretrained_weights/bioclip-2/open_clip_pytorch_model.bin).
2025-07-12 15:52:02,114 - root - INFO - Skipping pretraining... 
2025-07-12 15:52:02,126 - root - INFO - Checkpoint list, length: 8: 
2025-07-12 15:52:02,126 - root - INFO - 	ckp_1 
2025-07-12 15:52:02,126 - root - INFO - 	ckp_2 
2025-07-12 15:52:02,126 - root - INFO - 	ckp_3 
2025-07-12 15:52:02,126 - root - INFO - 	ckp_4 
2025-07-12 15:52:02,126 - root - INFO - 	ckp_5 
2025-07-12 15:52:02,126 - root - INFO - 	ckp_6 
2025-07-12 15:52:02,127 - root - INFO - 	ckp_7 
2025-07-12 15:52:02,127 - root - INFO - 	ckp_8 
2025-07-12 15:52:02,141 - root - INFO - Training on checkpoint ckp_1. 
2025-07-12 15:52:02,141 - root - INFO - Subset length: 0
2025-07-12 15:52:02,142 - root - INFO - Gathering samples from checkpoints: ['ckp_1']
2025-07-12 15:52:02,143 - root - INFO - Subset length: 66
2025-07-12 15:52:02,143 - root - INFO - Training dataset size: 0. 
2025-07-12 15:52:02,145 - root - INFO - Evaluation dataset size: 66. 
2025-07-12 15:52:02,146 - root - INFO - OOD mask: 0 / 0. 
2025-07-12 15:52:02,146 - root - INFO - AL mask: 0 / 0. 
2025-07-12 15:52:02,146 - root - INFO - Evaluating on next checkpoint ckp_1. 
2025-07-12 15:52:03,371 - root - INFO - Number of samples: 66, acc: 0.7727, balanced acc: 0.7611, loss: 2.6275. 
2025-07-12 15:52:03,371 - root - INFO - Saving predictions to /fs/scratch/PAS2099/mino/ICICLE/log_auto/pipeline/serengeti_serengeti_M10/upper_bound/2025-07-12-15-51-50/bioclip2/full_text_head/2025-07-12-15-51-55/log. 
2025-07-12 15:52:03,373 - root - INFO - Training on checkpoint ckp_2. 
2025-07-12 15:52:03,373 - root - INFO - Gathering samples from checkpoints: ['ckp_1']
2025-07-12 15:52:03,376 - root - INFO - Subset length: 105
2025-07-12 15:52:03,376 - root - INFO - Gathering samples from checkpoints: ['ckp_2']
2025-07-12 15:52:03,376 - root - INFO - Subset length: 23
2025-07-12 15:52:03,376 - root - INFO - Training dataset size: 105. 
2025-07-12 15:52:03,376 - root - INFO - Evaluation dataset size: 23. 
2025-07-12 15:52:03,377 - root - INFO - OOD mask: 0 / 105. 
2025-07-12 15:52:03,377 - root - INFO - AL mask: 0 / 105. 
2025-07-12 15:52:03,377 - root - INFO - Evaluating on current checkpoint ckp_1. 
2025-07-12 15:52:03,377 - root - INFO - Gathering samples from checkpoints: ['ckp_1']
2025-07-12 15:52:03,378 - root - INFO - Subset length: 66
2025-07-12 15:52:03,972 - root - INFO - Eval on current training checkpoint ckp_1: Number of samples: 66, acc: 0.7727, balanced acc: 0.7611, loss: 2.6275. 
2025-07-12 15:52:03,972 - root - INFO - Evaluating on next checkpoint ckp_2. 
2025-07-12 15:52:04,322 - root - INFO - Number of samples: 23, acc: 0.3913, balanced acc: 0.3750, loss: 2.6506. 
2025-07-12 15:52:04,322 - root - INFO - Saving predictions to /fs/scratch/PAS2099/mino/ICICLE/log_auto/pipeline/serengeti_serengeti_M10/upper_bound/2025-07-12-15-51-50/bioclip2/full_text_head/2025-07-12-15-51-55/log. 
2025-07-12 15:52:04,324 - root - INFO - Training on checkpoint ckp_3. 
2025-07-12 15:52:04,324 - root - INFO - Gathering samples from checkpoints: ['ckp_2']
2025-07-12 15:52:04,330 - root - INFO - Subset length: 251
2025-07-12 15:52:04,330 - root - INFO - Gathering samples from checkpoints: ['ckp_3']
2025-07-12 15:52:04,331 - root - INFO - Subset length: 64
2025-07-12 15:52:04,331 - root - INFO - Training dataset size: 251. 
2025-07-12 15:52:04,331 - root - INFO - Evaluation dataset size: 64. 
2025-07-12 15:52:04,331 - root - INFO - OOD mask: 0 / 251. 
2025-07-12 15:52:04,331 - root - INFO - AL mask: 0 / 251. 
2025-07-12 15:52:04,331 - root - INFO - Evaluating on current checkpoint ckp_2. 
2025-07-12 15:52:04,332 - root - INFO - Gathering samples from checkpoints: ['ckp_2']
2025-07-12 15:52:04,332 - root - INFO - Subset length: 23
2025-07-12 15:52:04,545 - root - INFO - Eval on current training checkpoint ckp_2: Number of samples: 23, acc: 0.3913, balanced acc: 0.3750, loss: 2.6506. 
2025-07-12 15:52:04,545 - root - INFO - Evaluating on next checkpoint ckp_3. 
2025-07-12 15:52:05,747 - root - INFO - Number of samples: 64, acc: 0.7031, balanced acc: 0.6952, loss: 2.6170. 
2025-07-12 15:52:05,748 - root - INFO - Saving predictions to /fs/scratch/PAS2099/mino/ICICLE/log_auto/pipeline/serengeti_serengeti_M10/upper_bound/2025-07-12-15-51-50/bioclip2/full_text_head/2025-07-12-15-51-55/log. 
2025-07-12 15:52:05,749 - root - INFO - Training on checkpoint ckp_4. 
2025-07-12 15:52:05,749 - root - INFO - Gathering samples from checkpoints: ['ckp_3']
2025-07-12 15:52:05,752 - root - INFO - Subset length: 99
2025-07-12 15:52:05,752 - root - INFO - Gathering samples from checkpoints: ['ckp_4']
2025-07-12 15:52:05,753 - root - INFO - Subset length: 67
2025-07-12 15:52:05,753 - root - INFO - Training dataset size: 99. 
2025-07-12 15:52:05,754 - root - INFO - Evaluation dataset size: 67. 
2025-07-12 15:52:05,754 - root - INFO - OOD mask: 0 / 99. 
2025-07-12 15:52:05,754 - root - INFO - AL mask: 0 / 99. 
2025-07-12 15:52:05,754 - root - INFO - Evaluating on current checkpoint ckp_3. 
2025-07-12 15:52:05,754 - root - INFO - Gathering samples from checkpoints: ['ckp_3']
2025-07-12 15:52:05,755 - root - INFO - Subset length: 64
2025-07-12 15:52:06,428 - root - INFO - Eval on current training checkpoint ckp_3: Number of samples: 64, acc: 0.7031, balanced acc: 0.6952, loss: 2.6170. 
2025-07-12 15:52:06,428 - root - INFO - Evaluating on next checkpoint ckp_4. 
2025-07-12 15:52:07,693 - root - INFO - Number of samples: 67, acc: 0.6716, balanced acc: 0.6679, loss: 2.6297. 
2025-07-12 15:52:07,694 - root - INFO - Saving predictions to /fs/scratch/PAS2099/mino/ICICLE/log_auto/pipeline/serengeti_serengeti_M10/upper_bound/2025-07-12-15-51-50/bioclip2/full_text_head/2025-07-12-15-51-55/log. 
2025-07-12 15:52:07,695 - root - INFO - Training on checkpoint ckp_5. 
2025-07-12 15:52:07,695 - root - INFO - Gathering samples from checkpoints: ['ckp_4']
2025-07-12 15:52:07,698 - root - INFO - Subset length: 105
2025-07-12 15:52:07,698 - root - INFO - Gathering samples from checkpoints: ['ckp_5']
2025-07-12 15:52:07,699 - root - INFO - Subset length: 56
2025-07-12 15:52:07,699 - root - INFO - Training dataset size: 105. 
2025-07-12 15:52:07,699 - root - INFO - Evaluation dataset size: 56. 
2025-07-12 15:52:07,699 - root - INFO - OOD mask: 0 / 105. 
2025-07-12 15:52:07,699 - root - INFO - AL mask: 0 / 105. 
2025-07-12 15:52:07,699 - root - INFO - Evaluating on current checkpoint ckp_4. 
2025-07-12 15:52:07,699 - root - INFO - Gathering samples from checkpoints: ['ckp_4']
2025-07-12 15:52:07,701 - root - INFO - Subset length: 67
2025-07-12 15:52:08,417 - root - INFO - Eval on current training checkpoint ckp_4: Number of samples: 67, acc: 0.6716, balanced acc: 0.6679, loss: 2.6297. 
2025-07-12 15:52:08,417 - root - INFO - Evaluating on next checkpoint ckp_5. 
2025-07-12 15:52:09,493 - root - INFO - Number of samples: 56, acc: 0.5179, balanced acc: 0.5333, loss: 2.6327. 
2025-07-12 15:52:09,494 - root - INFO - Saving predictions to /fs/scratch/PAS2099/mino/ICICLE/log_auto/pipeline/serengeti_serengeti_M10/upper_bound/2025-07-12-15-51-50/bioclip2/full_text_head/2025-07-12-15-51-55/log. 
2025-07-12 15:52:09,496 - root - INFO - Training on checkpoint ckp_6. 
2025-07-12 15:52:09,496 - root - INFO - Gathering samples from checkpoints: ['ckp_5']
2025-07-12 15:52:09,499 - root - INFO - Subset length: 122
2025-07-12 15:52:09,499 - root - INFO - Gathering samples from checkpoints: ['ckp_6']
2025-07-12 15:52:09,500 - root - INFO - Subset length: 32
2025-07-12 15:52:09,500 - root - INFO - Training dataset size: 122. 
2025-07-12 15:52:09,500 - root - INFO - Evaluation dataset size: 32. 
2025-07-12 15:52:09,500 - root - INFO - OOD mask: 0 / 122. 
2025-07-12 15:52:09,500 - root - INFO - AL mask: 0 / 122. 
2025-07-12 15:52:09,501 - root - INFO - Evaluating on current checkpoint ckp_5. 
2025-07-12 15:52:09,501 - root - INFO - Gathering samples from checkpoints: ['ckp_5']
2025-07-12 15:52:09,502 - root - INFO - Subset length: 56
2025-07-12 15:52:10,097 - root - INFO - Eval on current training checkpoint ckp_5: Number of samples: 56, acc: 0.5179, balanced acc: 0.5333, loss: 2.6327. 
2025-07-12 15:52:10,097 - root - INFO - Evaluating on next checkpoint ckp_6. 
2025-07-12 15:52:10,788 - root - INFO - Number of samples: 32, acc: 0.8438, balanced acc: 0.8333, loss: 2.6160. 
2025-07-12 15:52:10,788 - root - INFO - Saving predictions to /fs/scratch/PAS2099/mino/ICICLE/log_auto/pipeline/serengeti_serengeti_M10/upper_bound/2025-07-12-15-51-50/bioclip2/full_text_head/2025-07-12-15-51-55/log. 
2025-07-12 15:52:10,790 - root - INFO - Training on checkpoint ckp_7. 
2025-07-12 15:52:10,790 - root - INFO - Gathering samples from checkpoints: ['ckp_6']
2025-07-12 15:52:10,793 - root - INFO - Subset length: 136
2025-07-12 15:52:10,793 - root - INFO - Gathering samples from checkpoints: ['ckp_7']
2025-07-12 15:52:10,794 - root - INFO - Subset length: 31
2025-07-12 15:52:10,794 - root - INFO - Training dataset size: 136. 
2025-07-12 15:52:10,794 - root - INFO - Evaluation dataset size: 31. 
2025-07-12 15:52:10,794 - root - INFO - OOD mask: 0 / 136. 
2025-07-12 15:52:10,794 - root - INFO - AL mask: 0 / 136. 
2025-07-12 15:52:10,794 - root - INFO - Evaluating on current checkpoint ckp_6. 
2025-07-12 15:52:10,794 - root - INFO - Gathering samples from checkpoints: ['ckp_6']
2025-07-12 15:52:10,795 - root - INFO - Subset length: 32
2025-07-12 15:52:11,167 - root - INFO - Eval on current training checkpoint ckp_6: Number of samples: 32, acc: 0.8438, balanced acc: 0.8333, loss: 2.6160. 
2025-07-12 15:52:11,167 - root - INFO - Evaluating on next checkpoint ckp_7. 
2025-07-12 15:52:11,490 - root - INFO - Number of samples: 31, acc: 0.5484, balanced acc: 0.5333, loss: 2.6488. 
2025-07-12 15:52:11,490 - root - INFO - Saving predictions to /fs/scratch/PAS2099/mino/ICICLE/log_auto/pipeline/serengeti_serengeti_M10/upper_bound/2025-07-12-15-51-50/bioclip2/full_text_head/2025-07-12-15-51-55/log. 
2025-07-12 15:52:11,492 - root - INFO - Training on checkpoint ckp_8. 
2025-07-12 15:52:11,492 - root - INFO - Gathering samples from checkpoints: ['ckp_7']
2025-07-12 15:52:11,495 - root - INFO - Subset length: 136
2025-07-12 15:52:11,495 - root - INFO - Gathering samples from checkpoints: ['ckp_8']
2025-07-12 15:52:11,497 - root - INFO - Subset length: 67
2025-07-12 15:52:11,497 - root - INFO - Training dataset size: 136. 
2025-07-12 15:52:11,497 - root - INFO - Evaluation dataset size: 67. 
2025-07-12 15:52:11,497 - root - INFO - OOD mask: 0 / 136. 
2025-07-12 15:52:11,497 - root - INFO - AL mask: 0 / 136. 
2025-07-12 15:52:11,497 - root - INFO - Evaluating on current checkpoint ckp_7. 
2025-07-12 15:52:11,497 - root - INFO - Gathering samples from checkpoints: ['ckp_7']
2025-07-12 15:52:11,498 - root - INFO - Subset length: 31
2025-07-12 15:52:11,703 - root - INFO - Eval on current training checkpoint ckp_7: Number of samples: 31, acc: 0.5484, balanced acc: 0.5333, loss: 2.6488. 
2025-07-12 15:52:11,703 - root - INFO - Evaluating on next checkpoint ckp_8. 
2025-07-12 15:52:12,972 - root - INFO - Number of samples: 67, acc: 0.4627, balanced acc: 0.4528, loss: 2.6531. 
2025-07-12 15:52:12,973 - root - INFO - Saving predictions to /fs/scratch/PAS2099/mino/ICICLE/log_auto/pipeline/serengeti_serengeti_M10/upper_bound/2025-07-12-15-51-50/bioclip2/full_text_head/2025-07-12-15-51-55/log. 
wandb:                                                                                
wandb: 
wandb: Run history:
wandb:          accuracy ▇▁▆▅▃█▃▂
wandb: balanced_accuracy ▇▁▆▅▃█▃▂
wandb: 
wandb: Run summary:
wandb:          accuracy 0.46269
wandb: balanced_accuracy 0.45278
wandb: 
wandb: 🚀 View run serengeti_serengeti_M10 | upper_bound | 2025-07-12-15-51-50 | bioclip2 | full_text_head | 2025-07-12-15-51-55 at: https://wandb.ai/minodaze-the-ohio-state-university/ICICLE-Benchmark/runs/m7l7dlk4
wandb: ⭐️ View project at: https://wandb.ai/minodaze-the-ohio-state-university/ICICLE-Benchmark
wandb: Synced 5 W&B file(s), 0 media file(s), 0 artifact file(s) and 0 other file(s)
wandb: Find logs at: ./wandb/run-20250712_155155-m7l7dlk4/logs
2025-07-12 15:52:13,530 - root - INFO - Elapsed time: 18.05 seconds. 
/users/PAS2099/mino/miniconda3/envs/ICICLE/lib/python3.11/site-packages/timm/models/layers/__init__.py:48: FutureWarning: Importing from timm.models.layers is deprecated, please import via timm.layers
  warnings.warn(f"Importing from {__name__} is deprecated, please import via timm.layers", FutureWarning)
2025-07-12 15:52:19,858 - root - INFO - Saving to /fs/scratch/PAS2099/mino/ICICLE/log_auto/pipeline/serengeti_serengeti_C11/upper_bound/2025-07-12-15-52-15/bioclip2/full_text_head/2025-07-12-15-52-19/log. 
wandb: Currently logged in as: minodaze (minodaze-the-ohio-state-university) to https://api.wandb.ai. Use `wandb login --relogin` to force relogin
wandb: Tracking run with wandb version 0.20.1
wandb: Run data is saved locally in /users/PAS2099/mino/ICICLE/wandb/run-20250712_155220-12yvvqmz
wandb: Run `wandb offline` to turn off syncing.
wandb: Syncing run serengeti_serengeti_C11 | upper_bound | 2025-07-12-15-52-15 | bioclip2 | full_text_head | 2025-07-12-15-52-19
wandb: ⭐️ View project at https://wandb.ai/minodaze-the-ohio-state-university/ICICLE-Benchmark
wandb: 🚀 View run at https://wandb.ai/minodaze-the-ohio-state-university/ICICLE-Benchmark/runs/12yvvqmz
2025-07-12 15:52:20,777 - root - INFO - wandb logging is enabled.
2025-07-12 15:52:20,777 - root - INFO - {'accu_eval': False,
 'adapter_bottleneck': 64,
 'adapter_init': 'lora_kaiming',
 'adapter_scaler': 0.1,
 'al_config': {'method': 'none'},
 'attention_index': None,
 'attention_type': 'full',
 'bitfit': False,
 'block_index': None,
 'c': '/fs/scratch/PAS2099/mino/ICICLE/configs/generated_common/serengeti_serengeti_C11_upper_bound.yaml',
 'cl_config': {'method': 'none'},
 'common_config': {'model': 'bioclip2', 'train_data_config_path': '/fs/scratch/PAS2099/camera-trap-benchmark/serengeti/serengeti_C11/30/train.json', 'eval_data_config_path': '/fs/scratch/PAS2099/camera-trap-benchmark/serengeti/serengeti_C11/30/test.json', 'all_data_config_path': '/fs/scratch/PAS2099/camera-trap-benchmark/serengeti/serengeti_C11/30/train-all.json', 'train_batch_size': 32, 'eval_batch_size': 512, 'optimizer_name': 'AdamW', 'optimizer_params': {'lr': 2.5e-05, 'weight_decay': 0.0001}, 'chop_head': False, 'scheduler': 'CosineAnnealingLR', 'scheduler_params': {'T_max': 30, 'eta_min': 2.5e-06}},
 'convpass_bottleneck': 8,
 'convpass_init': 'lora_xavier',
 'convpass_scaler': 10,
 'convpass_xavier_init': False,
 'debug': False,
 'device': 'cuda',
 'difffit': False,
 'drop_path_rate': 0.0,
 'eval_only': False,
 'eval_per_epoch': False,
 'fact_dim': 8,
 'fact_scaler': 1.0,
 'fact_type': None,
 'ft_attn_ln': 'before',
 'ft_attn_mode': 'parallel',
 'ft_attn_module': None,
 'ft_mlp_ln': 'before',
 'ft_mlp_mode': 'parallel',
 'ft_mlp_module': None,
 'full': True,
 'generalization_test': 'a',
 'gpu_id': None,
 'gpu_memory_monitor': False,
 'interpolation_alpha': 0.5,
 'interpolation_head': False,
 'interpolation_model': False,
 'is_save': False,
 'label_type': 'common',
 'ln': False,
 'log_path': '/fs/scratch/PAS2099/mino/ICICLE/log_auto/pipeline/serengeti_serengeti_C11/upper_bound/2025-07-12-15-52-15/',
 'lora_bottleneck': 0,
 'merge_factor': 1,
 'mlp_index': None,
 'mlp_type': 'full',
 'module_name': 'upper_bound',
 'no_gpu_monitor_colors': False,
 'ood_config': {'method': 'none'},
 'pretrain_config': {'pretrain': False},
 'pretrained_weights': 'bioclip2',
 'repadapter_bottleneck': 8,
 'repadapter_group': 2,
 'repadapter_init': 'lora_xavier',
 'repadapter_scaler': 1,
 'save_dir': '/fs/scratch/PAS2099/mino/ICICLE/log_auto/pipeline/serengeti_serengeti_C11/upper_bound/2025-07-12-15-52-15/bioclip2/full_text_head/2025-07-12-15-52-19/log',
 'seed': 9527,
 'ssf': False,
 'text': 'head',
 'text_template': 'openai',
 'vpt_dropout': 0.1,
 'vpt_layer': None,
 'vpt_mode': None,
 'vpt_num': 10,
 'vqt_dropout': 0.1,
 'vqt_num': 0,
 'wandb': True}
2025-07-12 15:52:20,791 - root - INFO - Using Bioclip-2 model. 
2025-07-12 15:52:20,791 - root - INFO - Loaded ViT-L-14 model config.
2025-07-12 15:52:22,714 - root - INFO - Loading pretrained ViT-L-14 weights (pretrained_weights/bioclip-2/open_clip_pytorch_model.bin).
2025-07-12 15:52:25,462 - root - INFO - Skipping pretraining... 
2025-07-12 15:52:25,515 - root - INFO - Checkpoint list, length: 16: 
2025-07-12 15:52:25,515 - root - INFO - 	ckp_1 
2025-07-12 15:52:25,515 - root - INFO - 	ckp_2 
2025-07-12 15:52:25,515 - root - INFO - 	ckp_3 
2025-07-12 15:52:25,515 - root - INFO - 	ckp_4 
2025-07-12 15:52:25,516 - root - INFO - 	ckp_5 
2025-07-12 15:52:25,516 - root - INFO - 	ckp_6 
2025-07-12 15:52:25,516 - root - INFO - 	ckp_7 
2025-07-12 15:52:25,516 - root - INFO - 	ckp_8 
2025-07-12 15:52:25,516 - root - INFO - 	ckp_9 
2025-07-12 15:52:25,516 - root - INFO - 	ckp_10 
2025-07-12 15:52:25,516 - root - INFO - 	ckp_11 
2025-07-12 15:52:25,516 - root - INFO - 	ckp_12 
2025-07-12 15:52:25,516 - root - INFO - 	ckp_13 
2025-07-12 15:52:25,516 - root - INFO - 	ckp_14 
2025-07-12 15:52:25,516 - root - INFO - 	ckp_15 
2025-07-12 15:52:25,517 - root - INFO - 	ckp_16 
2025-07-12 15:52:25,531 - root - INFO - Training on checkpoint ckp_1. 
2025-07-12 15:52:25,532 - root - INFO - Subset length: 0
2025-07-12 15:52:25,532 - root - INFO - Gathering samples from checkpoints: ['ckp_1']
2025-07-12 15:52:25,534 - root - INFO - Subset length: 76
2025-07-12 15:52:25,534 - root - INFO - Training dataset size: 0. 
2025-07-12 15:52:25,534 - root - INFO - Evaluation dataset size: 76. 
2025-07-12 15:52:25,534 - root - INFO - OOD mask: 0 / 0. 
2025-07-12 15:52:25,534 - root - INFO - AL mask: 0 / 0. 
2025-07-12 15:52:25,534 - root - INFO - Evaluating on next checkpoint ckp_1. 
2025-07-12 15:52:26,905 - root - INFO - Number of samples: 76, acc: 0.5921, balanced acc: 0.5900, loss: 2.7635. 
2025-07-12 15:52:26,905 - root - INFO - Saving predictions to /fs/scratch/PAS2099/mino/ICICLE/log_auto/pipeline/serengeti_serengeti_C11/upper_bound/2025-07-12-15-52-15/bioclip2/full_text_head/2025-07-12-15-52-19/log. 
2025-07-12 15:52:26,906 - root - INFO - Training on checkpoint ckp_2. 
2025-07-12 15:52:26,906 - root - INFO - Gathering samples from checkpoints: ['ckp_1']
2025-07-12 15:52:26,922 - root - INFO - Subset length: 774
2025-07-12 15:52:26,922 - root - INFO - Gathering samples from checkpoints: ['ckp_2']
2025-07-12 15:52:26,924 - root - INFO - Subset length: 65
2025-07-12 15:52:26,924 - root - INFO - Training dataset size: 774. 
2025-07-12 15:52:26,924 - root - INFO - Evaluation dataset size: 65. 
2025-07-12 15:52:26,924 - root - INFO - OOD mask: 0 / 774. 
2025-07-12 15:52:26,924 - root - INFO - AL mask: 0 / 774. 
2025-07-12 15:52:26,924 - root - INFO - Evaluating on current checkpoint ckp_1. 
2025-07-12 15:52:26,924 - root - INFO - Gathering samples from checkpoints: ['ckp_1']
2025-07-12 15:52:26,926 - root - INFO - Subset length: 76
2025-07-12 15:52:27,642 - root - INFO - Eval on current training checkpoint ckp_1: Number of samples: 76, acc: 0.5921, balanced acc: 0.5900, loss: 2.7635. 
2025-07-12 15:52:27,643 - root - INFO - Evaluating on next checkpoint ckp_2. 
2025-07-12 15:52:28,477 - root - INFO - Number of samples: 65, acc: 0.8923, balanced acc: 0.8861, loss: 2.7428. 
2025-07-12 15:52:28,478 - root - INFO - Saving predictions to /fs/scratch/PAS2099/mino/ICICLE/log_auto/pipeline/serengeti_serengeti_C11/upper_bound/2025-07-12-15-52-15/bioclip2/full_text_head/2025-07-12-15-52-19/log. 
2025-07-12 15:52:28,479 - root - INFO - Training on checkpoint ckp_3. 
2025-07-12 15:52:28,479 - root - INFO - Gathering samples from checkpoints: ['ckp_2']
2025-07-12 15:52:28,482 - root - INFO - Subset length: 107
2025-07-12 15:52:28,482 - root - INFO - Gathering samples from checkpoints: ['ckp_3']
2025-07-12 15:52:28,483 - root - INFO - Subset length: 52
2025-07-12 15:52:28,484 - root - INFO - Training dataset size: 107. 
2025-07-12 15:52:28,484 - root - INFO - Evaluation dataset size: 52. 
2025-07-12 15:52:28,484 - root - INFO - OOD mask: 0 / 107. 
2025-07-12 15:52:28,484 - root - INFO - AL mask: 0 / 107. 
2025-07-12 15:52:28,484 - root - INFO - Evaluating on current checkpoint ckp_2. 
2025-07-12 15:52:28,484 - root - INFO - Gathering samples from checkpoints: ['ckp_2']
2025-07-12 15:52:28,485 - root - INFO - Subset length: 65
2025-07-12 15:52:28,986 - root - INFO - Eval on current training checkpoint ckp_2: Number of samples: 65, acc: 0.8923, balanced acc: 0.8861, loss: 2.7428. 
2025-07-12 15:52:28,986 - root - INFO - Evaluating on next checkpoint ckp_3. 
2025-07-12 15:52:29,575 - root - INFO - Number of samples: 52, acc: 0.7308, balanced acc: 0.7255, loss: 2.7522. 
2025-07-12 15:52:29,575 - root - INFO - Saving predictions to /fs/scratch/PAS2099/mino/ICICLE/log_auto/pipeline/serengeti_serengeti_C11/upper_bound/2025-07-12-15-52-15/bioclip2/full_text_head/2025-07-12-15-52-19/log. 
2025-07-12 15:52:29,577 - root - INFO - Training on checkpoint ckp_4. 
2025-07-12 15:52:29,577 - root - INFO - Gathering samples from checkpoints: ['ckp_3']
2025-07-12 15:52:29,742 - root - INFO - Subset length: 1507
2025-07-12 15:52:29,742 - root - INFO - Gathering samples from checkpoints: ['ckp_4']
2025-07-12 15:52:29,744 - root - INFO - Subset length: 64
2025-07-12 15:52:29,744 - root - INFO - Training dataset size: 1507. 
2025-07-12 15:52:29,744 - root - INFO - Evaluation dataset size: 64. 
2025-07-12 15:52:29,744 - root - INFO - OOD mask: 0 / 1507. 
2025-07-12 15:52:29,744 - root - INFO - AL mask: 0 / 1507. 
2025-07-12 15:52:29,744 - root - INFO - Evaluating on current checkpoint ckp_3. 
2025-07-12 15:52:29,744 - root - INFO - Gathering samples from checkpoints: ['ckp_3']
2025-07-12 15:52:29,746 - root - INFO - Subset length: 52
2025-07-12 15:52:30,113 - root - INFO - Eval on current training checkpoint ckp_3: Number of samples: 52, acc: 0.7308, balanced acc: 0.7255, loss: 2.7522. 
2025-07-12 15:52:30,114 - root - INFO - Evaluating on next checkpoint ckp_4. 
2025-07-12 15:52:30,672 - root - INFO - Number of samples: 64, acc: 0.6562, balanced acc: 0.6727, loss: 2.7610. 
2025-07-12 15:52:30,672 - root - INFO - Saving predictions to /fs/scratch/PAS2099/mino/ICICLE/log_auto/pipeline/serengeti_serengeti_C11/upper_bound/2025-07-12-15-52-15/bioclip2/full_text_head/2025-07-12-15-52-19/log. 
2025-07-12 15:52:30,673 - root - INFO - Training on checkpoint ckp_5. 
2025-07-12 15:52:30,673 - root - INFO - Gathering samples from checkpoints: ['ckp_4']
2025-07-12 15:52:30,676 - root - INFO - Subset length: 112
2025-07-12 15:52:30,677 - root - INFO - Gathering samples from checkpoints: ['ckp_5']
2025-07-12 15:52:30,678 - root - INFO - Subset length: 65
2025-07-12 15:52:30,678 - root - INFO - Training dataset size: 112. 
2025-07-12 15:52:30,679 - root - INFO - Evaluation dataset size: 65. 
2025-07-12 15:52:30,679 - root - INFO - OOD mask: 0 / 112. 
2025-07-12 15:52:30,679 - root - INFO - AL mask: 0 / 112. 
2025-07-12 15:52:30,679 - root - INFO - Evaluating on current checkpoint ckp_4. 
2025-07-12 15:52:30,679 - root - INFO - Gathering samples from checkpoints: ['ckp_4']
2025-07-12 15:52:30,680 - root - INFO - Subset length: 64
2025-07-12 15:52:31,063 - root - INFO - Eval on current training checkpoint ckp_4: Number of samples: 64, acc: 0.6562, balanced acc: 0.6727, loss: 2.7610. 
2025-07-12 15:52:31,063 - root - INFO - Evaluating on next checkpoint ckp_5. 
2025-07-12 15:52:31,743 - root - INFO - Number of samples: 65, acc: 0.5538, balanced acc: 0.5571, loss: 2.7536. 
2025-07-12 15:52:31,743 - root - INFO - Saving predictions to /fs/scratch/PAS2099/mino/ICICLE/log_auto/pipeline/serengeti_serengeti_C11/upper_bound/2025-07-12-15-52-15/bioclip2/full_text_head/2025-07-12-15-52-19/log. 
2025-07-12 15:52:31,746 - root - INFO - Training on checkpoint ckp_6. 
2025-07-12 15:52:31,747 - root - INFO - Gathering samples from checkpoints: ['ckp_5']
2025-07-12 15:52:31,749 - root - INFO - Subset length: 100
2025-07-12 15:52:31,749 - root - INFO - Gathering samples from checkpoints: ['ckp_6']
2025-07-12 15:52:31,750 - root - INFO - Subset length: 46
2025-07-12 15:52:31,750 - root - INFO - Training dataset size: 100. 
2025-07-12 15:52:31,750 - root - INFO - Evaluation dataset size: 46. 
2025-07-12 15:52:31,750 - root - INFO - OOD mask: 0 / 100. 
2025-07-12 15:52:31,750 - root - INFO - AL mask: 0 / 100. 
2025-07-12 15:52:31,751 - root - INFO - Evaluating on current checkpoint ckp_5. 
2025-07-12 15:52:31,751 - root - INFO - Gathering samples from checkpoints: ['ckp_5']
2025-07-12 15:52:31,752 - root - INFO - Subset length: 65
2025-07-12 15:52:32,174 - root - INFO - Eval on current training checkpoint ckp_5: Number of samples: 65, acc: 0.5538, balanced acc: 0.5571, loss: 2.7536. 
2025-07-12 15:52:32,174 - root - INFO - Evaluating on next checkpoint ckp_6. 
2025-07-12 15:52:32,633 - root - INFO - Number of samples: 46, acc: 0.9348, balanced acc: 0.9375, loss: 2.7459. 
2025-07-12 15:52:32,634 - root - INFO - Saving predictions to /fs/scratch/PAS2099/mino/ICICLE/log_auto/pipeline/serengeti_serengeti_C11/upper_bound/2025-07-12-15-52-15/bioclip2/full_text_head/2025-07-12-15-52-19/log. 
2025-07-12 15:52:32,635 - root - INFO - Training on checkpoint ckp_7. 
2025-07-12 15:52:32,635 - root - INFO - Gathering samples from checkpoints: ['ckp_6']
2025-07-12 15:52:32,638 - root - INFO - Subset length: 127
2025-07-12 15:52:32,639 - root - INFO - Gathering samples from checkpoints: ['ckp_7']
2025-07-12 15:52:32,640 - root - INFO - Subset length: 73
2025-07-12 15:52:32,640 - root - INFO - Training dataset size: 127. 
2025-07-12 15:52:32,640 - root - INFO - Evaluation dataset size: 73. 
2025-07-12 15:52:32,640 - root - INFO - OOD mask: 0 / 127. 
2025-07-12 15:52:32,640 - root - INFO - AL mask: 0 / 127. 
2025-07-12 15:52:32,641 - root - INFO - Evaluating on current checkpoint ckp_6. 
2025-07-12 15:52:32,641 - root - INFO - Gathering samples from checkpoints: ['ckp_6']
2025-07-12 15:52:32,642 - root - INFO - Subset length: 46
2025-07-12 15:52:32,939 - root - INFO - Eval on current training checkpoint ckp_6: Number of samples: 46, acc: 0.9348, balanced acc: 0.9375, loss: 2.7459. 
2025-07-12 15:52:32,940 - root - INFO - Evaluating on next checkpoint ckp_7. 
2025-07-12 15:52:33,812 - root - INFO - Number of samples: 73, acc: 0.9726, balanced acc: 0.9740, loss: 2.7213. 
2025-07-12 15:52:33,813 - root - INFO - Saving predictions to /fs/scratch/PAS2099/mino/ICICLE/log_auto/pipeline/serengeti_serengeti_C11/upper_bound/2025-07-12-15-52-15/bioclip2/full_text_head/2025-07-12-15-52-19/log. 
2025-07-12 15:52:33,814 - root - INFO - Training on checkpoint ckp_8. 
2025-07-12 15:52:33,815 - root - INFO - Gathering samples from checkpoints: ['ckp_7']
2025-07-12 15:52:33,825 - root - INFO - Subset length: 515
2025-07-12 15:52:33,825 - root - INFO - Gathering samples from checkpoints: ['ckp_8']
2025-07-12 15:52:33,826 - root - INFO - Subset length: 47
2025-07-12 15:52:33,827 - root - INFO - Training dataset size: 515. 
2025-07-12 15:52:33,827 - root - INFO - Evaluation dataset size: 47. 
2025-07-12 15:52:33,827 - root - INFO - OOD mask: 0 / 515. 
2025-07-12 15:52:33,827 - root - INFO - AL mask: 0 / 515. 
2025-07-12 15:52:33,827 - root - INFO - Evaluating on current checkpoint ckp_7. 
2025-07-12 15:52:33,827 - root - INFO - Gathering samples from checkpoints: ['ckp_7']
2025-07-12 15:52:33,829 - root - INFO - Subset length: 73
2025-07-12 15:52:34,415 - root - INFO - Eval on current training checkpoint ckp_7: Number of samples: 73, acc: 0.9726, balanced acc: 0.9740, loss: 2.7213. 
2025-07-12 15:52:34,416 - root - INFO - Evaluating on next checkpoint ckp_8. 
2025-07-12 15:52:34,916 - root - INFO - Number of samples: 47, acc: 0.8936, balanced acc: 0.8958, loss: 2.7280. 
2025-07-12 15:52:34,917 - root - INFO - Saving predictions to /fs/scratch/PAS2099/mino/ICICLE/log_auto/pipeline/serengeti_serengeti_C11/upper_bound/2025-07-12-15-52-15/bioclip2/full_text_head/2025-07-12-15-52-19/log. 
2025-07-12 15:52:34,918 - root - INFO - Training on checkpoint ckp_9. 
2025-07-12 15:52:34,918 - root - INFO - Gathering samples from checkpoints: ['ckp_8']
2025-07-12 15:52:34,921 - root - INFO - Subset length: 126
2025-07-12 15:52:34,922 - root - INFO - Gathering samples from checkpoints: ['ckp_9']
2025-07-12 15:52:34,923 - root - INFO - Subset length: 30
2025-07-12 15:52:34,923 - root - INFO - Training dataset size: 126. 
2025-07-12 15:52:34,923 - root - INFO - Evaluation dataset size: 30. 
2025-07-12 15:52:34,923 - root - INFO - OOD mask: 0 / 126. 
2025-07-12 15:52:34,923 - root - INFO - AL mask: 0 / 126. 
2025-07-12 15:52:34,923 - root - INFO - Evaluating on current checkpoint ckp_8. 
2025-07-12 15:52:34,923 - root - INFO - Gathering samples from checkpoints: ['ckp_8']
2025-07-12 15:52:34,924 - root - INFO - Subset length: 47
2025-07-12 15:52:35,238 - root - INFO - Eval on current training checkpoint ckp_8: Number of samples: 47, acc: 0.8936, balanced acc: 0.8958, loss: 2.7280. 
2025-07-12 15:52:35,238 - root - INFO - Evaluating on next checkpoint ckp_9. 
2025-07-12 15:52:35,554 - root - INFO - Number of samples: 30, acc: 0.7667, balanced acc: 0.7667, loss: 2.7366. 
2025-07-12 15:52:35,554 - root - INFO - Saving predictions to /fs/scratch/PAS2099/mino/ICICLE/log_auto/pipeline/serengeti_serengeti_C11/upper_bound/2025-07-12-15-52-15/bioclip2/full_text_head/2025-07-12-15-52-19/log. 
2025-07-12 15:52:35,556 - root - INFO - Training on checkpoint ckp_10. 
2025-07-12 15:52:35,556 - root - INFO - Gathering samples from checkpoints: ['ckp_9']
2025-07-12 15:52:35,559 - root - INFO - Subset length: 150
2025-07-12 15:52:35,559 - root - INFO - Gathering samples from checkpoints: ['ckp_10']
2025-07-12 15:52:35,562 - root - INFO - Subset length: 97
2025-07-12 15:52:35,562 - root - INFO - Training dataset size: 150. 
2025-07-12 15:52:35,562 - root - INFO - Evaluation dataset size: 97. 
2025-07-12 15:52:35,562 - root - INFO - OOD mask: 0 / 150. 
2025-07-12 15:52:35,562 - root - INFO - AL mask: 0 / 150. 
2025-07-12 15:52:35,562 - root - INFO - Evaluating on current checkpoint ckp_9. 
2025-07-12 15:52:35,562 - root - INFO - Gathering samples from checkpoints: ['ckp_9']
2025-07-12 15:52:35,563 - root - INFO - Subset length: 30
2025-07-12 15:52:35,774 - root - INFO - Eval on current training checkpoint ckp_9: Number of samples: 30, acc: 0.7667, balanced acc: 0.7667, loss: 2.7366. 
2025-07-12 15:52:35,774 - root - INFO - Evaluating on next checkpoint ckp_10. 
2025-07-12 15:52:37,860 - root - INFO - Number of samples: 97, acc: 0.7835, balanced acc: 0.7773, loss: 2.7456. 
2025-07-12 15:52:37,861 - root - INFO - Saving predictions to /fs/scratch/PAS2099/mino/ICICLE/log_auto/pipeline/serengeti_serengeti_C11/upper_bound/2025-07-12-15-52-15/bioclip2/full_text_head/2025-07-12-15-52-19/log. 
2025-07-12 15:52:37,862 - root - INFO - Training on checkpoint ckp_11. 
2025-07-12 15:52:37,862 - root - INFO - Gathering samples from checkpoints: ['ckp_10']
2025-07-12 15:52:37,880 - root - INFO - Subset length: 787
2025-07-12 15:52:37,880 - root - INFO - Gathering samples from checkpoints: ['ckp_11']
2025-07-12 15:52:37,882 - root - INFO - Subset length: 56
2025-07-12 15:52:37,882 - root - INFO - Training dataset size: 787. 
2025-07-12 15:52:37,882 - root - INFO - Evaluation dataset size: 56. 
2025-07-12 15:52:37,882 - root - INFO - OOD mask: 0 / 787. 
2025-07-12 15:52:37,882 - root - INFO - AL mask: 0 / 787. 
2025-07-12 15:52:37,882 - root - INFO - Evaluating on current checkpoint ckp_10. 
2025-07-12 15:52:37,882 - root - INFO - Gathering samples from checkpoints: ['ckp_10']
2025-07-12 15:52:37,884 - root - INFO - Subset length: 97
2025-07-12 15:52:39,016 - root - INFO - Eval on current training checkpoint ckp_10: Number of samples: 97, acc: 0.7835, balanced acc: 0.7773, loss: 2.7456. 
2025-07-12 15:52:39,017 - root - INFO - Evaluating on next checkpoint ckp_11. 
2025-07-12 15:52:39,881 - root - INFO - Number of samples: 56, acc: 0.9107, balanced acc: 0.9033, loss: 2.7293. 
2025-07-12 15:52:39,882 - root - INFO - Saving predictions to /fs/scratch/PAS2099/mino/ICICLE/log_auto/pipeline/serengeti_serengeti_C11/upper_bound/2025-07-12-15-52-15/bioclip2/full_text_head/2025-07-12-15-52-19/log. 
2025-07-12 15:52:39,885 - root - INFO - Training on checkpoint ckp_12. 
2025-07-12 15:52:39,885 - root - INFO - Gathering samples from checkpoints: ['ckp_11']
2025-07-12 15:52:39,888 - root - INFO - Subset length: 122
2025-07-12 15:52:39,889 - root - INFO - Gathering samples from checkpoints: ['ckp_12']
2025-07-12 15:52:39,890 - root - INFO - Subset length: 67
2025-07-12 15:52:39,890 - root - INFO - Training dataset size: 122. 
2025-07-12 15:52:39,890 - root - INFO - Evaluation dataset size: 67. 
2025-07-12 15:52:39,890 - root - INFO - OOD mask: 0 / 122. 
2025-07-12 15:52:39,890 - root - INFO - AL mask: 0 / 122. 
2025-07-12 15:52:39,891 - root - INFO - Evaluating on current checkpoint ckp_11. 
2025-07-12 15:52:39,891 - root - INFO - Gathering samples from checkpoints: ['ckp_11']
2025-07-12 15:52:39,892 - root - INFO - Subset length: 56
2025-07-12 15:52:40,395 - root - INFO - Eval on current training checkpoint ckp_11: Number of samples: 56, acc: 0.9107, balanced acc: 0.9033, loss: 2.7293. 
2025-07-12 15:52:40,395 - root - INFO - Evaluating on next checkpoint ckp_12. 
2025-07-12 15:52:41,267 - root - INFO - Number of samples: 67, acc: 0.8955, balanced acc: 0.8904, loss: 2.7387. 
2025-07-12 15:52:41,267 - root - INFO - Saving predictions to /fs/scratch/PAS2099/mino/ICICLE/log_auto/pipeline/serengeti_serengeti_C11/upper_bound/2025-07-12-15-52-15/bioclip2/full_text_head/2025-07-12-15-52-19/log. 
2025-07-12 15:52:41,268 - root - INFO - Training on checkpoint ckp_13. 
2025-07-12 15:52:41,268 - root - INFO - Gathering samples from checkpoints: ['ckp_12']
2025-07-12 15:52:41,271 - root - INFO - Subset length: 111
2025-07-12 15:52:41,271 - root - INFO - Gathering samples from checkpoints: ['ckp_13']
2025-07-12 15:52:41,273 - root - INFO - Subset length: 94
2025-07-12 15:52:41,273 - root - INFO - Training dataset size: 111. 
2025-07-12 15:52:41,273 - root - INFO - Evaluation dataset size: 94. 
2025-07-12 15:52:41,273 - root - INFO - OOD mask: 0 / 111. 
2025-07-12 15:52:41,274 - root - INFO - AL mask: 0 / 111. 
2025-07-12 15:52:41,274 - root - INFO - Evaluating on current checkpoint ckp_12. 
2025-07-12 15:52:41,274 - root - INFO - Gathering samples from checkpoints: ['ckp_12']
2025-07-12 15:52:41,275 - root - INFO - Subset length: 67
2025-07-12 15:52:41,797 - root - INFO - Eval on current training checkpoint ckp_12: Number of samples: 67, acc: 0.8955, balanced acc: 0.8904, loss: 2.7387. 
2025-07-12 15:52:41,797 - root - INFO - Evaluating on next checkpoint ckp_13. 
2025-07-12 15:52:43,153 - root - INFO - Number of samples: 94, acc: 0.8936, balanced acc: 0.8930, loss: 2.7334. 
2025-07-12 15:52:43,153 - root - INFO - Saving predictions to /fs/scratch/PAS2099/mino/ICICLE/log_auto/pipeline/serengeti_serengeti_C11/upper_bound/2025-07-12-15-52-15/bioclip2/full_text_head/2025-07-12-15-52-19/log. 
2025-07-12 15:52:43,155 - root - INFO - Training on checkpoint ckp_14. 
2025-07-12 15:52:43,155 - root - INFO - Gathering samples from checkpoints: ['ckp_13']
2025-07-12 15:52:43,171 - root - INFO - Subset length: 756
2025-07-12 15:52:43,171 - root - INFO - Gathering samples from checkpoints: ['ckp_14']
2025-07-12 15:52:43,172 - root - INFO - Subset length: 72
2025-07-12 15:52:43,172 - root - INFO - Training dataset size: 756. 
2025-07-12 15:52:43,172 - root - INFO - Evaluation dataset size: 72. 
2025-07-12 15:52:43,173 - root - INFO - OOD mask: 0 / 756. 
2025-07-12 15:52:43,173 - root - INFO - AL mask: 0 / 756. 
2025-07-12 15:52:43,173 - root - INFO - Evaluating on current checkpoint ckp_13. 
2025-07-12 15:52:43,173 - root - INFO - Gathering samples from checkpoints: ['ckp_13']
2025-07-12 15:52:43,175 - root - INFO - Subset length: 94
2025-07-12 15:52:43,964 - root - INFO - Eval on current training checkpoint ckp_13: Number of samples: 94, acc: 0.8936, balanced acc: 0.8930, loss: 2.7334. 
2025-07-12 15:52:43,965 - root - INFO - Evaluating on next checkpoint ckp_14. 
2025-07-12 15:52:45,185 - root - INFO - Number of samples: 72, acc: 0.9028, balanced acc: 0.9028, loss: 2.7427. 
2025-07-12 15:52:45,185 - root - INFO - Saving predictions to /fs/scratch/PAS2099/mino/ICICLE/log_auto/pipeline/serengeti_serengeti_C11/upper_bound/2025-07-12-15-52-15/bioclip2/full_text_head/2025-07-12-15-52-19/log. 
2025-07-12 15:52:45,187 - root - INFO - Training on checkpoint ckp_15. 
2025-07-12 15:52:45,187 - root - INFO - Gathering samples from checkpoints: ['ckp_14']
2025-07-12 15:52:45,214 - root - INFO - Subset length: 1391
2025-07-12 15:52:45,214 - root - INFO - Gathering samples from checkpoints: ['ckp_15']
2025-07-12 15:52:45,215 - root - INFO - Subset length: 42
2025-07-12 15:52:45,216 - root - INFO - Training dataset size: 1391. 
2025-07-12 15:52:45,216 - root - INFO - Evaluation dataset size: 42. 
2025-07-12 15:52:45,216 - root - INFO - OOD mask: 0 / 1391. 
2025-07-12 15:52:45,216 - root - INFO - AL mask: 0 / 1391. 
2025-07-12 15:52:45,216 - root - INFO - Evaluating on current checkpoint ckp_14. 
2025-07-12 15:52:45,216 - root - INFO - Gathering samples from checkpoints: ['ckp_14']
2025-07-12 15:52:45,218 - root - INFO - Subset length: 72
2025-07-12 15:52:45,910 - root - INFO - Eval on current training checkpoint ckp_14: Number of samples: 72, acc: 0.9028, balanced acc: 0.9028, loss: 2.7427. 
2025-07-12 15:52:45,910 - root - INFO - Evaluating on next checkpoint ckp_15. 
2025-07-12 15:52:46,567 - root - INFO - Number of samples: 42, acc: 0.8571, balanced acc: 0.8500, loss: 2.7476. 
2025-07-12 15:52:46,569 - root - INFO - Saving predictions to /fs/scratch/PAS2099/mino/ICICLE/log_auto/pipeline/serengeti_serengeti_C11/upper_bound/2025-07-12-15-52-15/bioclip2/full_text_head/2025-07-12-15-52-19/log. 
2025-07-12 15:52:46,570 - root - INFO - Training on checkpoint ckp_16. 
2025-07-12 15:52:46,570 - root - INFO - Gathering samples from checkpoints: ['ckp_15']
2025-07-12 15:52:46,574 - root - INFO - Subset length: 150
2025-07-12 15:52:46,574 - root - INFO - Gathering samples from checkpoints: ['ckp_16']
2025-07-12 15:52:46,577 - root - INFO - Subset length: 94
2025-07-12 15:52:46,577 - root - INFO - Training dataset size: 150. 
2025-07-12 15:52:46,577 - root - INFO - Evaluation dataset size: 94. 
2025-07-12 15:52:46,577 - root - INFO - OOD mask: 0 / 150. 
2025-07-12 15:52:46,577 - root - INFO - AL mask: 0 / 150. 
2025-07-12 15:52:46,577 - root - INFO - Evaluating on current checkpoint ckp_15. 
2025-07-12 15:52:46,577 - root - INFO - Gathering samples from checkpoints: ['ckp_15']
2025-07-12 15:52:46,578 - root - INFO - Subset length: 42
2025-07-12 15:52:46,956 - root - INFO - Eval on current training checkpoint ckp_15: Number of samples: 42, acc: 0.8571, balanced acc: 0.8500, loss: 2.7476. 
2025-07-12 15:52:46,957 - root - INFO - Evaluating on next checkpoint ckp_16. 
2025-07-12 15:52:49,012 - root - INFO - Number of samples: 94, acc: 0.6915, balanced acc: 0.6979, loss: 2.7509. 
2025-07-12 15:52:49,012 - root - INFO - Saving predictions to /fs/scratch/PAS2099/mino/ICICLE/log_auto/pipeline/serengeti_serengeti_C11/upper_bound/2025-07-12-15-52-15/bioclip2/full_text_head/2025-07-12-15-52-19/log. 
wandb:                                                                                
wandb: 
wandb: Run history:
wandb:          accuracy ▂▇▄▃▁▇█▇▅▅▇▇▇▇▆▃
wandb: balanced_accuracy ▂▇▄▃▁▇█▇▅▅▇▇▇▇▆▃
wandb: 
wandb: Run summary:
wandb:          accuracy 0.69149
wandb: balanced_accuracy 0.69792
wandb: 
wandb: 🚀 View run serengeti_serengeti_C11 | upper_bound | 2025-07-12-15-52-15 | bioclip2 | full_text_head | 2025-07-12-15-52-19 at: https://wandb.ai/minodaze-the-ohio-state-university/ICICLE-Benchmark/runs/12yvvqmz
wandb: ⭐️ View project at: https://wandb.ai/minodaze-the-ohio-state-university/ICICLE-Benchmark
wandb: Synced 5 W&B file(s), 0 media file(s), 0 artifact file(s) and 0 other file(s)
wandb: Find logs at: ./wandb/run-20250712_155220-12yvvqmz/logs
2025-07-12 15:52:49,630 - root - INFO - Elapsed time: 29.77 seconds. 
/users/PAS2099/mino/miniconda3/envs/ICICLE/lib/python3.11/site-packages/timm/models/layers/__init__.py:48: FutureWarning: Importing from timm.models.layers is deprecated, please import via timm.layers
  warnings.warn(f"Importing from {__name__} is deprecated, please import via timm.layers", FutureWarning)
2025-07-12 15:52:55,706 - root - INFO - Saving to /fs/scratch/PAS2099/mino/ICICLE/log_auto/pipeline/serengeti_serengeti_C03/upper_bound/2025-07-12-15-52-51/bioclip2/full_text_head/2025-07-12-15-52-55/log. 
wandb: Currently logged in as: minodaze (minodaze-the-ohio-state-university) to https://api.wandb.ai. Use `wandb login --relogin` to force relogin
wandb: Tracking run with wandb version 0.20.1
wandb: Run data is saved locally in /users/PAS2099/mino/ICICLE/wandb/run-20250712_155255-d3y96bgv
wandb: Run `wandb offline` to turn off syncing.
wandb: Syncing run serengeti_serengeti_C03 | upper_bound | 2025-07-12-15-52-51 | bioclip2 | full_text_head | 2025-07-12-15-52-55
wandb: ⭐️ View project at https://wandb.ai/minodaze-the-ohio-state-university/ICICLE-Benchmark
wandb: 🚀 View run at https://wandb.ai/minodaze-the-ohio-state-university/ICICLE-Benchmark/runs/d3y96bgv
2025-07-12 15:52:56,641 - root - INFO - wandb logging is enabled.
2025-07-12 15:52:56,642 - root - INFO - {'accu_eval': False,
 'adapter_bottleneck': 64,
 'adapter_init': 'lora_kaiming',
 'adapter_scaler': 0.1,
 'al_config': {'method': 'none'},
 'attention_index': None,
 'attention_type': 'full',
 'bitfit': False,
 'block_index': None,
 'c': '/fs/scratch/PAS2099/mino/ICICLE/configs/generated_common/serengeti_serengeti_C03_upper_bound.yaml',
 'cl_config': {'method': 'none'},
 'common_config': {'model': 'bioclip2', 'train_data_config_path': '/fs/scratch/PAS2099/camera-trap-benchmark/serengeti/serengeti_C03/30/train.json', 'eval_data_config_path': '/fs/scratch/PAS2099/camera-trap-benchmark/serengeti/serengeti_C03/30/test.json', 'all_data_config_path': '/fs/scratch/PAS2099/camera-trap-benchmark/serengeti/serengeti_C03/30/train-all.json', 'train_batch_size': 32, 'eval_batch_size': 512, 'optimizer_name': 'AdamW', 'optimizer_params': {'lr': 2.5e-05, 'weight_decay': 0.0001}, 'chop_head': False, 'scheduler': 'CosineAnnealingLR', 'scheduler_params': {'T_max': 30, 'eta_min': 2.5e-06}},
 'convpass_bottleneck': 8,
 'convpass_init': 'lora_xavier',
 'convpass_scaler': 10,
 'convpass_xavier_init': False,
 'debug': False,
 'device': 'cuda',
 'difffit': False,
 'drop_path_rate': 0.0,
 'eval_only': False,
 'eval_per_epoch': False,
 'fact_dim': 8,
 'fact_scaler': 1.0,
 'fact_type': None,
 'ft_attn_ln': 'before',
 'ft_attn_mode': 'parallel',
 'ft_attn_module': None,
 'ft_mlp_ln': 'before',
 'ft_mlp_mode': 'parallel',
 'ft_mlp_module': None,
 'full': True,
 'generalization_test': 'a',
 'gpu_id': None,
 'gpu_memory_monitor': False,
 'interpolation_alpha': 0.5,
 'interpolation_head': False,
 'interpolation_model': False,
 'is_save': False,
 'label_type': 'common',
 'ln': False,
 'log_path': '/fs/scratch/PAS2099/mino/ICICLE/log_auto/pipeline/serengeti_serengeti_C03/upper_bound/2025-07-12-15-52-51/',
 'lora_bottleneck': 0,
 'merge_factor': 1,
 'mlp_index': None,
 'mlp_type': 'full',
 'module_name': 'upper_bound',
 'no_gpu_monitor_colors': False,
 'ood_config': {'method': 'none'},
 'pretrain_config': {'pretrain': False},
 'pretrained_weights': 'bioclip2',
 'repadapter_bottleneck': 8,
 'repadapter_group': 2,
 'repadapter_init': 'lora_xavier',
 'repadapter_scaler': 1,
 'save_dir': '/fs/scratch/PAS2099/mino/ICICLE/log_auto/pipeline/serengeti_serengeti_C03/upper_bound/2025-07-12-15-52-51/bioclip2/full_text_head/2025-07-12-15-52-55/log',
 'seed': 9527,
 'ssf': False,
 'text': 'head',
 'text_template': 'openai',
 'vpt_dropout': 0.1,
 'vpt_layer': None,
 'vpt_mode': None,
 'vpt_num': 10,
 'vqt_dropout': 0.1,
 'vqt_num': 0,
 'wandb': True}
2025-07-12 15:52:56,651 - root - INFO - Using Bioclip-2 model. 
2025-07-12 15:52:56,652 - root - INFO - Loaded ViT-L-14 model config.
2025-07-12 15:52:58,562 - root - INFO - Loading pretrained ViT-L-14 weights (pretrained_weights/bioclip-2/open_clip_pytorch_model.bin).
2025-07-12 15:53:01,107 - root - INFO - Skipping pretraining... 
2025-07-12 15:53:01,149 - root - INFO - Checkpoint list, length: 20: 
2025-07-12 15:53:01,149 - root - INFO - 	ckp_1 
2025-07-12 15:53:01,149 - root - INFO - 	ckp_2 
2025-07-12 15:53:01,149 - root - INFO - 	ckp_3 
2025-07-12 15:53:01,149 - root - INFO - 	ckp_4 
2025-07-12 15:53:01,149 - root - INFO - 	ckp_5 
2025-07-12 15:53:01,149 - root - INFO - 	ckp_6 
2025-07-12 15:53:01,149 - root - INFO - 	ckp_7 
2025-07-12 15:53:01,149 - root - INFO - 	ckp_8 
2025-07-12 15:53:01,149 - root - INFO - 	ckp_9 
2025-07-12 15:53:01,149 - root - INFO - 	ckp_10 
2025-07-12 15:53:01,149 - root - INFO - 	ckp_11 
2025-07-12 15:53:01,149 - root - INFO - 	ckp_12 
2025-07-12 15:53:01,149 - root - INFO - 	ckp_13 
2025-07-12 15:53:01,149 - root - INFO - 	ckp_14 
2025-07-12 15:53:01,149 - root - INFO - 	ckp_15 
2025-07-12 15:53:01,150 - root - INFO - 	ckp_16 
2025-07-12 15:53:01,150 - root - INFO - 	ckp_17 
2025-07-12 15:53:01,150 - root - INFO - 	ckp_18 
2025-07-12 15:53:01,150 - root - INFO - 	ckp_19 
2025-07-12 15:53:01,150 - root - INFO - 	ckp_20 
2025-07-12 15:53:01,165 - root - INFO - Training on checkpoint ckp_1. 
2025-07-12 15:53:01,165 - root - INFO - Subset length: 0
2025-07-12 15:53:01,165 - root - INFO - Gathering samples from checkpoints: ['ckp_1']
2025-07-12 15:53:01,167 - root - INFO - Subset length: 75
2025-07-12 15:53:01,167 - root - INFO - Training dataset size: 0. 
2025-07-12 15:53:01,167 - root - INFO - Evaluation dataset size: 75. 
2025-07-12 15:53:01,168 - root - INFO - OOD mask: 0 / 0. 
2025-07-12 15:53:01,168 - root - INFO - AL mask: 0 / 0. 
2025-07-12 15:53:01,168 - root - INFO - Evaluating on next checkpoint ckp_1. 
2025-07-12 15:53:02,083 - root - INFO - Number of samples: 75, acc: 0.8133, balanced acc: 0.8026, loss: 2.4660. 
2025-07-12 15:53:02,083 - root - INFO - Saving predictions to /fs/scratch/PAS2099/mino/ICICLE/log_auto/pipeline/serengeti_serengeti_C03/upper_bound/2025-07-12-15-52-51/bioclip2/full_text_head/2025-07-12-15-52-55/log. 
2025-07-12 15:53:02,085 - root - INFO - Training on checkpoint ckp_2. 
2025-07-12 15:53:02,085 - root - INFO - Gathering samples from checkpoints: ['ckp_1']
2025-07-12 15:53:02,088 - root - INFO - Subset length: 103
2025-07-12 15:53:02,088 - root - INFO - Gathering samples from checkpoints: ['ckp_2']
2025-07-12 15:53:02,088 - root - INFO - Subset length: 30
2025-07-12 15:53:02,089 - root - INFO - Training dataset size: 103. 
2025-07-12 15:53:02,089 - root - INFO - Evaluation dataset size: 30. 
2025-07-12 15:53:02,089 - root - INFO - OOD mask: 0 / 103. 
2025-07-12 15:53:02,089 - root - INFO - AL mask: 0 / 103. 
2025-07-12 15:53:02,089 - root - INFO - Evaluating on current checkpoint ckp_1. 
2025-07-12 15:53:02,089 - root - INFO - Gathering samples from checkpoints: ['ckp_1']
2025-07-12 15:53:02,091 - root - INFO - Subset length: 75
2025-07-12 15:53:02,612 - root - INFO - Eval on current training checkpoint ckp_1: Number of samples: 75, acc: 0.8133, balanced acc: 0.8026, loss: 2.4660. 
2025-07-12 15:53:02,612 - root - INFO - Evaluating on next checkpoint ckp_2. 
2025-07-12 15:53:03,134 - root - INFO - Number of samples: 30, acc: 0.8667, balanced acc: 0.8667, loss: 2.4714. 
2025-07-12 15:53:03,134 - root - INFO - Saving predictions to /fs/scratch/PAS2099/mino/ICICLE/log_auto/pipeline/serengeti_serengeti_C03/upper_bound/2025-07-12-15-52-51/bioclip2/full_text_head/2025-07-12-15-52-55/log. 
2025-07-12 15:53:03,136 - root - INFO - Training on checkpoint ckp_3. 
2025-07-12 15:53:03,136 - root - INFO - Gathering samples from checkpoints: ['ckp_2']
2025-07-12 15:53:03,139 - root - INFO - Subset length: 142
2025-07-12 15:53:03,139 - root - INFO - Gathering samples from checkpoints: ['ckp_3']
2025-07-12 15:53:03,140 - root - INFO - Subset length: 30
2025-07-12 15:53:03,140 - root - INFO - Training dataset size: 142. 
2025-07-12 15:53:03,140 - root - INFO - Evaluation dataset size: 30. 
2025-07-12 15:53:03,140 - root - INFO - OOD mask: 0 / 142. 
2025-07-12 15:53:03,140 - root - INFO - AL mask: 0 / 142. 
2025-07-12 15:53:03,140 - root - INFO - Evaluating on current checkpoint ckp_2. 
2025-07-12 15:53:03,140 - root - INFO - Gathering samples from checkpoints: ['ckp_2']
2025-07-12 15:53:03,141 - root - INFO - Subset length: 30
2025-07-12 15:53:03,441 - root - INFO - Eval on current training checkpoint ckp_2: Number of samples: 30, acc: 0.8667, balanced acc: 0.8667, loss: 2.4714. 
2025-07-12 15:53:03,441 - root - INFO - Evaluating on next checkpoint ckp_3. 
2025-07-12 15:53:04,080 - root - INFO - Number of samples: 30, acc: 0.7667, balanced acc: 0.7667, loss: 2.4736. 
2025-07-12 15:53:04,081 - root - INFO - Saving predictions to /fs/scratch/PAS2099/mino/ICICLE/log_auto/pipeline/serengeti_serengeti_C03/upper_bound/2025-07-12-15-52-51/bioclip2/full_text_head/2025-07-12-15-52-55/log. 
2025-07-12 15:53:04,083 - root - INFO - Training on checkpoint ckp_4. 
2025-07-12 15:53:04,083 - root - INFO - Gathering samples from checkpoints: ['ckp_3']
2025-07-12 15:53:04,089 - root - INFO - Subset length: 271
2025-07-12 15:53:04,089 - root - INFO - Gathering samples from checkpoints: ['ckp_4']
2025-07-12 15:53:04,090 - root - INFO - Subset length: 56
2025-07-12 15:53:04,090 - root - INFO - Training dataset size: 271. 
2025-07-12 15:53:04,091 - root - INFO - Evaluation dataset size: 56. 
2025-07-12 15:53:04,091 - root - INFO - OOD mask: 0 / 271. 
2025-07-12 15:53:04,091 - root - INFO - AL mask: 0 / 271. 
2025-07-12 15:53:04,091 - root - INFO - Evaluating on current checkpoint ckp_3. 
2025-07-12 15:53:04,091 - root - INFO - Gathering samples from checkpoints: ['ckp_3']
2025-07-12 15:53:04,092 - root - INFO - Subset length: 30
2025-07-12 15:53:04,427 - root - INFO - Eval on current training checkpoint ckp_3: Number of samples: 30, acc: 0.7667, balanced acc: 0.7667, loss: 2.4736. 
2025-07-12 15:53:04,427 - root - INFO - Evaluating on next checkpoint ckp_4. 
2025-07-12 15:53:05,524 - root - INFO - Number of samples: 56, acc: 0.9107, balanced acc: 0.9121, loss: 2.4755. 
2025-07-12 15:53:05,524 - root - INFO - Saving predictions to /fs/scratch/PAS2099/mino/ICICLE/log_auto/pipeline/serengeti_serengeti_C03/upper_bound/2025-07-12-15-52-51/bioclip2/full_text_head/2025-07-12-15-52-55/log. 
2025-07-12 15:53:05,526 - root - INFO - Training on checkpoint ckp_5. 
2025-07-12 15:53:05,526 - root - INFO - Gathering samples from checkpoints: ['ckp_4']
2025-07-12 15:53:05,697 - root - INFO - Subset length: 1804
2025-07-12 15:53:05,698 - root - INFO - Gathering samples from checkpoints: ['ckp_5']
2025-07-12 15:53:05,699 - root - INFO - Subset length: 53
2025-07-12 15:53:05,699 - root - INFO - Training dataset size: 1804. 
2025-07-12 15:53:05,699 - root - INFO - Evaluation dataset size: 53. 
2025-07-12 15:53:05,699 - root - INFO - OOD mask: 0 / 1804. 
2025-07-12 15:53:05,699 - root - INFO - AL mask: 0 / 1804. 
2025-07-12 15:53:05,699 - root - INFO - Evaluating on current checkpoint ckp_4. 
2025-07-12 15:53:05,699 - root - INFO - Gathering samples from checkpoints: ['ckp_4']
2025-07-12 15:53:05,701 - root - INFO - Subset length: 56
2025-07-12 15:53:06,279 - root - INFO - Eval on current training checkpoint ckp_4: Number of samples: 56, acc: 0.9107, balanced acc: 0.9121, loss: 2.4755. 
2025-07-12 15:53:06,279 - root - INFO - Evaluating on next checkpoint ckp_5. 
2025-07-12 15:53:07,364 - root - INFO - Number of samples: 53, acc: 0.9057, balanced acc: 0.9000, loss: 2.4597. 
2025-07-12 15:53:07,364 - root - INFO - Saving predictions to /fs/scratch/PAS2099/mino/ICICLE/log_auto/pipeline/serengeti_serengeti_C03/upper_bound/2025-07-12-15-52-51/bioclip2/full_text_head/2025-07-12-15-52-55/log. 
2025-07-12 15:53:07,366 - root - INFO - Training on checkpoint ckp_6. 
2025-07-12 15:53:07,366 - root - INFO - Gathering samples from checkpoints: ['ckp_5']
2025-07-12 15:53:07,369 - root - INFO - Subset length: 121
2025-07-12 15:53:07,370 - root - INFO - Gathering samples from checkpoints: ['ckp_6']
2025-07-12 15:53:07,372 - root - INFO - Subset length: 69
2025-07-12 15:53:07,372 - root - INFO - Training dataset size: 121. 
2025-07-12 15:53:07,372 - root - INFO - Evaluation dataset size: 69. 
2025-07-12 15:53:07,372 - root - INFO - OOD mask: 0 / 121. 
2025-07-12 15:53:07,372 - root - INFO - AL mask: 0 / 121. 
2025-07-12 15:53:07,373 - root - INFO - Evaluating on current checkpoint ckp_5. 
2025-07-12 15:53:07,373 - root - INFO - Gathering samples from checkpoints: ['ckp_5']
2025-07-12 15:53:07,374 - root - INFO - Subset length: 53
2025-07-12 15:53:07,926 - root - INFO - Eval on current training checkpoint ckp_5: Number of samples: 53, acc: 0.9057, balanced acc: 0.9000, loss: 2.4597. 
2025-07-12 15:53:07,926 - root - INFO - Evaluating on next checkpoint ckp_6. 
2025-07-12 15:53:09,258 - root - INFO - Number of samples: 69, acc: 0.8841, balanced acc: 0.8864, loss: 2.4749. 
2025-07-12 15:53:09,259 - root - INFO - Saving predictions to /fs/scratch/PAS2099/mino/ICICLE/log_auto/pipeline/serengeti_serengeti_C03/upper_bound/2025-07-12-15-52-51/bioclip2/full_text_head/2025-07-12-15-52-55/log. 
2025-07-12 15:53:09,260 - root - INFO - Training on checkpoint ckp_7. 
2025-07-12 15:53:09,260 - root - INFO - Gathering samples from checkpoints: ['ckp_6']
2025-07-12 15:53:09,263 - root - INFO - Subset length: 114
2025-07-12 15:53:09,263 - root - INFO - Gathering samples from checkpoints: ['ckp_7']
2025-07-12 15:53:09,264 - root - INFO - Subset length: 34
2025-07-12 15:53:09,264 - root - INFO - Training dataset size: 114. 
2025-07-12 15:53:09,264 - root - INFO - Evaluation dataset size: 34. 
2025-07-12 15:53:09,264 - root - INFO - OOD mask: 0 / 114. 
2025-07-12 15:53:09,264 - root - INFO - AL mask: 0 / 114. 
2025-07-12 15:53:09,264 - root - INFO - Evaluating on current checkpoint ckp_6. 
2025-07-12 15:53:09,265 - root - INFO - Gathering samples from checkpoints: ['ckp_6']
2025-07-12 15:53:09,266 - root - INFO - Subset length: 69
2025-07-12 15:53:09,983 - root - INFO - Eval on current training checkpoint ckp_6: Number of samples: 69, acc: 0.8841, balanced acc: 0.8864, loss: 2.4749. 
2025-07-12 15:53:09,984 - root - INFO - Evaluating on next checkpoint ckp_7. 
2025-07-12 15:53:10,528 - root - INFO - Number of samples: 34, acc: 0.9118, balanced acc: 0.9111, loss: 2.4723. 
2025-07-12 15:53:10,528 - root - INFO - Saving predictions to /fs/scratch/PAS2099/mino/ICICLE/log_auto/pipeline/serengeti_serengeti_C03/upper_bound/2025-07-12-15-52-51/bioclip2/full_text_head/2025-07-12-15-52-55/log. 
2025-07-12 15:53:10,530 - root - INFO - Training on checkpoint ckp_8. 
2025-07-12 15:53:10,530 - root - INFO - Gathering samples from checkpoints: ['ckp_7']
2025-07-12 15:53:10,533 - root - INFO - Subset length: 131
2025-07-12 15:53:10,533 - root - INFO - Gathering samples from checkpoints: ['ckp_8']
2025-07-12 15:53:10,534 - root - INFO - Subset length: 43
2025-07-12 15:53:10,534 - root - INFO - Training dataset size: 131. 
2025-07-12 15:53:10,534 - root - INFO - Evaluation dataset size: 43. 
2025-07-12 15:53:10,534 - root - INFO - OOD mask: 0 / 131. 
2025-07-12 15:53:10,534 - root - INFO - AL mask: 0 / 131. 
2025-07-12 15:53:10,534 - root - INFO - Evaluating on current checkpoint ckp_7. 
2025-07-12 15:53:10,534 - root - INFO - Gathering samples from checkpoints: ['ckp_7']
2025-07-12 15:53:10,535 - root - INFO - Subset length: 34
2025-07-12 15:53:10,838 - root - INFO - Eval on current training checkpoint ckp_7: Number of samples: 34, acc: 0.9118, balanced acc: 0.9111, loss: 2.4723. 
2025-07-12 15:53:10,838 - root - INFO - Evaluating on next checkpoint ckp_8. 
2025-07-12 15:53:11,502 - root - INFO - Number of samples: 43, acc: 0.9535, balanced acc: 0.9523, loss: 2.4797. 
2025-07-12 15:53:11,503 - root - INFO - Saving predictions to /fs/scratch/PAS2099/mino/ICICLE/log_auto/pipeline/serengeti_serengeti_C03/upper_bound/2025-07-12-15-52-51/bioclip2/full_text_head/2025-07-12-15-52-55/log. 
2025-07-12 15:53:11,504 - root - INFO - Training on checkpoint ckp_9. 
2025-07-12 15:53:11,504 - root - INFO - Gathering samples from checkpoints: ['ckp_8']
2025-07-12 15:53:11,507 - root - INFO - Subset length: 120
2025-07-12 15:53:11,507 - root - INFO - Gathering samples from checkpoints: ['ckp_9']
2025-07-12 15:53:11,509 - root - INFO - Subset length: 65
2025-07-12 15:53:11,509 - root - INFO - Training dataset size: 120. 
2025-07-12 15:53:11,509 - root - INFO - Evaluation dataset size: 65. 
2025-07-12 15:53:11,509 - root - INFO - OOD mask: 0 / 120. 
2025-07-12 15:53:11,509 - root - INFO - AL mask: 0 / 120. 
2025-07-12 15:53:11,509 - root - INFO - Evaluating on current checkpoint ckp_8. 
2025-07-12 15:53:11,509 - root - INFO - Gathering samples from checkpoints: ['ckp_8']
2025-07-12 15:53:11,510 - root - INFO - Subset length: 43
2025-07-12 15:53:11,877 - root - INFO - Eval on current training checkpoint ckp_8: Number of samples: 43, acc: 0.9535, balanced acc: 0.9523, loss: 2.4797. 
2025-07-12 15:53:11,878 - root - INFO - Evaluating on next checkpoint ckp_9. 
2025-07-12 15:53:12,791 - root - INFO - Number of samples: 65, acc: 0.8000, balanced acc: 0.8035, loss: 2.4810. 
2025-07-12 15:53:12,791 - root - INFO - Saving predictions to /fs/scratch/PAS2099/mino/ICICLE/log_auto/pipeline/serengeti_serengeti_C03/upper_bound/2025-07-12-15-52-51/bioclip2/full_text_head/2025-07-12-15-52-55/log. 
2025-07-12 15:53:12,793 - root - INFO - Training on checkpoint ckp_10. 
2025-07-12 15:53:12,793 - root - INFO - Gathering samples from checkpoints: ['ckp_9']
2025-07-12 15:53:12,795 - root - INFO - Subset length: 98
2025-07-12 15:53:12,795 - root - INFO - Gathering samples from checkpoints: ['ckp_10']
2025-07-12 15:53:12,796 - root - INFO - Subset length: 44
2025-07-12 15:53:12,796 - root - INFO - Training dataset size: 98. 
2025-07-12 15:53:12,796 - root - INFO - Evaluation dataset size: 44. 
2025-07-12 15:53:12,797 - root - INFO - OOD mask: 0 / 98. 
2025-07-12 15:53:12,797 - root - INFO - AL mask: 0 / 98. 
2025-07-12 15:53:12,797 - root - INFO - Evaluating on current checkpoint ckp_9. 
2025-07-12 15:53:12,797 - root - INFO - Gathering samples from checkpoints: ['ckp_9']
2025-07-12 15:53:12,798 - root - INFO - Subset length: 65
2025-07-12 15:53:13,293 - root - INFO - Eval on current training checkpoint ckp_9: Number of samples: 65, acc: 0.8000, balanced acc: 0.8035, loss: 2.4810. 
2025-07-12 15:53:13,293 - root - INFO - Evaluating on next checkpoint ckp_10. 
2025-07-12 15:53:14,098 - root - INFO - Number of samples: 44, acc: 0.8409, balanced acc: 0.8485, loss: 2.4776. 
2025-07-12 15:53:14,098 - root - INFO - Saving predictions to /fs/scratch/PAS2099/mino/ICICLE/log_auto/pipeline/serengeti_serengeti_C03/upper_bound/2025-07-12-15-52-51/bioclip2/full_text_head/2025-07-12-15-52-55/log. 
2025-07-12 15:53:14,099 - root - INFO - Training on checkpoint ckp_11. 
2025-07-12 15:53:14,100 - root - INFO - Gathering samples from checkpoints: ['ckp_10']
2025-07-12 15:53:14,103 - root - INFO - Subset length: 140
2025-07-12 15:53:14,103 - root - INFO - Gathering samples from checkpoints: ['ckp_11']
2025-07-12 15:53:14,104 - root - INFO - Subset length: 32
2025-07-12 15:53:14,104 - root - INFO - Training dataset size: 140. 
2025-07-12 15:53:14,104 - root - INFO - Evaluation dataset size: 32. 
2025-07-12 15:53:14,104 - root - INFO - OOD mask: 0 / 140. 
2025-07-12 15:53:14,104 - root - INFO - AL mask: 0 / 140. 
2025-07-12 15:53:14,104 - root - INFO - Evaluating on current checkpoint ckp_10. 
2025-07-12 15:53:14,104 - root - INFO - Gathering samples from checkpoints: ['ckp_10']
2025-07-12 15:53:14,105 - root - INFO - Subset length: 44
2025-07-12 15:53:14,514 - root - INFO - Eval on current training checkpoint ckp_10: Number of samples: 44, acc: 0.8409, balanced acc: 0.8485, loss: 2.4776. 
2025-07-12 15:53:14,514 - root - INFO - Evaluating on next checkpoint ckp_11. 
2025-07-12 15:53:15,217 - root - INFO - Number of samples: 32, acc: 0.6875, balanced acc: 0.6848, loss: 2.4928. 
2025-07-12 15:53:15,218 - root - INFO - Saving predictions to /fs/scratch/PAS2099/mino/ICICLE/log_auto/pipeline/serengeti_serengeti_C03/upper_bound/2025-07-12-15-52-51/bioclip2/full_text_head/2025-07-12-15-52-55/log. 
2025-07-12 15:53:15,219 - root - INFO - Training on checkpoint ckp_12. 
2025-07-12 15:53:15,219 - root - INFO - Gathering samples from checkpoints: ['ckp_11']
2025-07-12 15:53:15,235 - root - INFO - Subset length: 811
2025-07-12 15:53:15,235 - root - INFO - Gathering samples from checkpoints: ['ckp_12']
2025-07-12 15:53:15,237 - root - INFO - Subset length: 57
2025-07-12 15:53:15,237 - root - INFO - Training dataset size: 811. 
2025-07-12 15:53:15,237 - root - INFO - Evaluation dataset size: 57. 
2025-07-12 15:53:15,237 - root - INFO - OOD mask: 0 / 811. 
2025-07-12 15:53:15,237 - root - INFO - AL mask: 0 / 811. 
2025-07-12 15:53:15,237 - root - INFO - Evaluating on current checkpoint ckp_11. 
2025-07-12 15:53:15,237 - root - INFO - Gathering samples from checkpoints: ['ckp_11']
2025-07-12 15:53:15,238 - root - INFO - Subset length: 32
2025-07-12 15:53:15,581 - root - INFO - Eval on current training checkpoint ckp_11: Number of samples: 32, acc: 0.6875, balanced acc: 0.6848, loss: 2.4928. 
2025-07-12 15:53:15,581 - root - INFO - Evaluating on next checkpoint ckp_12. 
2025-07-12 15:53:16,673 - root - INFO - Number of samples: 57, acc: 0.9123, balanced acc: 0.9167, loss: 2.4674. 
2025-07-12 15:53:16,674 - root - INFO - Saving predictions to /fs/scratch/PAS2099/mino/ICICLE/log_auto/pipeline/serengeti_serengeti_C03/upper_bound/2025-07-12-15-52-51/bioclip2/full_text_head/2025-07-12-15-52-55/log. 
2025-07-12 15:53:16,675 - root - INFO - Training on checkpoint ckp_13. 
2025-07-12 15:53:16,675 - root - INFO - Gathering samples from checkpoints: ['ckp_12']
2025-07-12 15:53:16,678 - root - INFO - Subset length: 130
2025-07-12 15:53:16,679 - root - INFO - Gathering samples from checkpoints: ['ckp_13']
2025-07-12 15:53:16,680 - root - INFO - Subset length: 42
2025-07-12 15:53:16,680 - root - INFO - Training dataset size: 130. 
2025-07-12 15:53:16,680 - root - INFO - Evaluation dataset size: 42. 
2025-07-12 15:53:16,680 - root - INFO - OOD mask: 0 / 130. 
2025-07-12 15:53:16,680 - root - INFO - AL mask: 0 / 130. 
2025-07-12 15:53:16,680 - root - INFO - Evaluating on current checkpoint ckp_12. 
2025-07-12 15:53:16,680 - root - INFO - Gathering samples from checkpoints: ['ckp_12']
2025-07-12 15:53:16,682 - root - INFO - Subset length: 57
2025-07-12 15:53:17,264 - root - INFO - Eval on current training checkpoint ckp_12: Number of samples: 57, acc: 0.9123, balanced acc: 0.9167, loss: 2.4674. 
2025-07-12 15:53:17,264 - root - INFO - Evaluating on next checkpoint ckp_13. 
2025-07-12 15:53:18,029 - root - INFO - Number of samples: 42, acc: 0.8810, balanced acc: 0.8750, loss: 2.4774. 
2025-07-12 15:53:18,029 - root - INFO - Saving predictions to /fs/scratch/PAS2099/mino/ICICLE/log_auto/pipeline/serengeti_serengeti_C03/upper_bound/2025-07-12-15-52-51/bioclip2/full_text_head/2025-07-12-15-52-55/log. 
2025-07-12 15:53:18,031 - root - INFO - Training on checkpoint ckp_14. 
2025-07-12 15:53:18,031 - root - INFO - Gathering samples from checkpoints: ['ckp_13']
2025-07-12 15:53:18,034 - root - INFO - Subset length: 146
2025-07-12 15:53:18,035 - root - INFO - Gathering samples from checkpoints: ['ckp_14']
2025-07-12 15:53:18,035 - root - INFO - Subset length: 30
2025-07-12 15:53:18,035 - root - INFO - Training dataset size: 146. 
2025-07-12 15:53:18,036 - root - INFO - Evaluation dataset size: 30. 
2025-07-12 15:53:18,036 - root - INFO - OOD mask: 0 / 146. 
2025-07-12 15:53:18,036 - root - INFO - AL mask: 0 / 146. 
2025-07-12 15:53:18,036 - root - INFO - Evaluating on current checkpoint ckp_13. 
2025-07-12 15:53:18,036 - root - INFO - Gathering samples from checkpoints: ['ckp_13']
2025-07-12 15:53:18,037 - root - INFO - Subset length: 42
2025-07-12 15:53:18,449 - root - INFO - Eval on current training checkpoint ckp_13: Number of samples: 42, acc: 0.8810, balanced acc: 0.8750, loss: 2.4774. 
2025-07-12 15:53:18,449 - root - INFO - Evaluating on next checkpoint ckp_14. 
2025-07-12 15:53:19,080 - root - INFO - Number of samples: 30, acc: 0.8333, balanced acc: 0.8333, loss: 2.4736. 
2025-07-12 15:53:19,080 - root - INFO - Saving predictions to /fs/scratch/PAS2099/mino/ICICLE/log_auto/pipeline/serengeti_serengeti_C03/upper_bound/2025-07-12-15-52-51/bioclip2/full_text_head/2025-07-12-15-52-55/log. 
2025-07-12 15:53:19,081 - root - INFO - Training on checkpoint ckp_15. 
2025-07-12 15:53:19,082 - root - INFO - Gathering samples from checkpoints: ['ckp_14']
2025-07-12 15:53:19,087 - root - INFO - Subset length: 268
2025-07-12 15:53:19,088 - root - INFO - Gathering samples from checkpoints: ['ckp_15']
2025-07-12 15:53:19,089 - root - INFO - Subset length: 55
2025-07-12 15:53:19,089 - root - INFO - Training dataset size: 268. 
2025-07-12 15:53:19,089 - root - INFO - Evaluation dataset size: 55. 
2025-07-12 15:53:19,089 - root - INFO - OOD mask: 0 / 268. 
2025-07-12 15:53:19,089 - root - INFO - AL mask: 0 / 268. 
2025-07-12 15:53:19,089 - root - INFO - Evaluating on current checkpoint ckp_14. 
2025-07-12 15:53:19,089 - root - INFO - Gathering samples from checkpoints: ['ckp_14']
2025-07-12 15:53:19,090 - root - INFO - Subset length: 30
2025-07-12 15:53:19,419 - root - INFO - Eval on current training checkpoint ckp_14: Number of samples: 30, acc: 0.8333, balanced acc: 0.8333, loss: 2.4736. 
2025-07-12 15:53:19,419 - root - INFO - Evaluating on next checkpoint ckp_15. 
2025-07-12 15:53:20,487 - root - INFO - Number of samples: 55, acc: 0.8000, balanced acc: 0.8106, loss: 2.4826. 
2025-07-12 15:53:20,487 - root - INFO - Saving predictions to /fs/scratch/PAS2099/mino/ICICLE/log_auto/pipeline/serengeti_serengeti_C03/upper_bound/2025-07-12-15-52-51/bioclip2/full_text_head/2025-07-12-15-52-55/log. 
2025-07-12 15:53:20,488 - root - INFO - Training on checkpoint ckp_16. 
2025-07-12 15:53:20,489 - root - INFO - Gathering samples from checkpoints: ['ckp_15']
2025-07-12 15:53:20,492 - root - INFO - Subset length: 142
2025-07-12 15:53:20,492 - root - INFO - Gathering samples from checkpoints: ['ckp_16']
2025-07-12 15:53:20,493 - root - INFO - Subset length: 54
2025-07-12 15:53:20,493 - root - INFO - Training dataset size: 142. 
2025-07-12 15:53:20,493 - root - INFO - Evaluation dataset size: 54. 
2025-07-12 15:53:20,494 - root - INFO - OOD mask: 0 / 142. 
2025-07-12 15:53:20,494 - root - INFO - AL mask: 0 / 142. 
2025-07-12 15:53:20,494 - root - INFO - Evaluating on current checkpoint ckp_15. 
2025-07-12 15:53:20,494 - root - INFO - Gathering samples from checkpoints: ['ckp_15']
2025-07-12 15:53:20,495 - root - INFO - Subset length: 55
2025-07-12 15:53:21,068 - root - INFO - Eval on current training checkpoint ckp_15: Number of samples: 55, acc: 0.8000, balanced acc: 0.8106, loss: 2.4826. 
2025-07-12 15:53:21,069 - root - INFO - Evaluating on next checkpoint ckp_16. 
2025-07-12 15:53:22,055 - root - INFO - Number of samples: 54, acc: 0.8889, balanced acc: 0.8800, loss: 2.4744. 
2025-07-12 15:53:22,055 - root - INFO - Saving predictions to /fs/scratch/PAS2099/mino/ICICLE/log_auto/pipeline/serengeti_serengeti_C03/upper_bound/2025-07-12-15-52-51/bioclip2/full_text_head/2025-07-12-15-52-55/log. 
2025-07-12 15:53:22,056 - root - INFO - Training on checkpoint ckp_17. 
2025-07-12 15:53:22,056 - root - INFO - Gathering samples from checkpoints: ['ckp_16']
2025-07-12 15:53:22,059 - root - INFO - Subset length: 128
2025-07-12 15:53:22,060 - root - INFO - Gathering samples from checkpoints: ['ckp_17']
2025-07-12 15:53:22,060 - root - INFO - Subset length: 33
2025-07-12 15:53:22,060 - root - INFO - Training dataset size: 128. 
2025-07-12 15:53:22,060 - root - INFO - Evaluation dataset size: 33. 
2025-07-12 15:53:22,061 - root - INFO - OOD mask: 0 / 128. 
2025-07-12 15:53:22,061 - root - INFO - AL mask: 0 / 128. 
2025-07-12 15:53:22,061 - root - INFO - Evaluating on current checkpoint ckp_16. 
2025-07-12 15:53:22,061 - root - INFO - Gathering samples from checkpoints: ['ckp_16']
2025-07-12 15:53:22,062 - root - INFO - Subset length: 54
2025-07-12 15:53:22,599 - root - INFO - Eval on current training checkpoint ckp_16: Number of samples: 54, acc: 0.8889, balanced acc: 0.8800, loss: 2.4744. 
2025-07-12 15:53:22,599 - root - INFO - Evaluating on next checkpoint ckp_17. 
2025-07-12 15:53:23,374 - root - INFO - Number of samples: 33, acc: 0.9394, balanced acc: 0.9444, loss: 2.4705. 
2025-07-12 15:53:23,374 - root - INFO - Saving predictions to /fs/scratch/PAS2099/mino/ICICLE/log_auto/pipeline/serengeti_serengeti_C03/upper_bound/2025-07-12-15-52-51/bioclip2/full_text_head/2025-07-12-15-52-55/log. 
2025-07-12 15:53:23,376 - root - INFO - Training on checkpoint ckp_18. 
2025-07-12 15:53:23,376 - root - INFO - Gathering samples from checkpoints: ['ckp_17']
2025-07-12 15:53:23,380 - root - INFO - Subset length: 181
2025-07-12 15:53:23,380 - root - INFO - Gathering samples from checkpoints: ['ckp_18']
2025-07-12 15:53:23,381 - root - INFO - Subset length: 53
2025-07-12 15:53:23,381 - root - INFO - Training dataset size: 181. 
2025-07-12 15:53:23,381 - root - INFO - Evaluation dataset size: 53. 
2025-07-12 15:53:23,381 - root - INFO - OOD mask: 0 / 181. 
2025-07-12 15:53:23,381 - root - INFO - AL mask: 0 / 181. 
2025-07-12 15:53:23,381 - root - INFO - Evaluating on current checkpoint ckp_17. 
2025-07-12 15:53:23,382 - root - INFO - Gathering samples from checkpoints: ['ckp_17']
2025-07-12 15:53:23,382 - root - INFO - Subset length: 33
2025-07-12 15:53:23,807 - root - INFO - Eval on current training checkpoint ckp_17: Number of samples: 33, acc: 0.9394, balanced acc: 0.9444, loss: 2.4705. 
2025-07-12 15:53:23,807 - root - INFO - Evaluating on next checkpoint ckp_18. 
2025-07-12 15:53:24,978 - root - INFO - Number of samples: 53, acc: 0.8868, balanced acc: 0.8933, loss: 2.4779. 
2025-07-12 15:53:24,978 - root - INFO - Saving predictions to /fs/scratch/PAS2099/mino/ICICLE/log_auto/pipeline/serengeti_serengeti_C03/upper_bound/2025-07-12-15-52-51/bioclip2/full_text_head/2025-07-12-15-52-55/log. 
2025-07-12 15:53:24,979 - root - INFO - Training on checkpoint ckp_19. 
2025-07-12 15:53:24,980 - root - INFO - Gathering samples from checkpoints: ['ckp_18']
2025-07-12 15:53:24,983 - root - INFO - Subset length: 145
2025-07-12 15:53:24,983 - root - INFO - Gathering samples from checkpoints: ['ckp_19']
2025-07-12 15:53:24,984 - root - INFO - Subset length: 55
2025-07-12 15:53:24,984 - root - INFO - Training dataset size: 145. 
2025-07-12 15:53:24,984 - root - INFO - Evaluation dataset size: 55. 
2025-07-12 15:53:24,984 - root - INFO - OOD mask: 0 / 145. 
2025-07-12 15:53:24,985 - root - INFO - AL mask: 0 / 145. 
2025-07-12 15:53:24,985 - root - INFO - Evaluating on current checkpoint ckp_18. 
2025-07-12 15:53:24,985 - root - INFO - Gathering samples from checkpoints: ['ckp_18']
2025-07-12 15:53:24,986 - root - INFO - Subset length: 53
2025-07-12 15:53:25,594 - root - INFO - Eval on current training checkpoint ckp_18: Number of samples: 53, acc: 0.8868, balanced acc: 0.8933, loss: 2.4779. 
2025-07-12 15:53:25,594 - root - INFO - Evaluating on next checkpoint ckp_19. 
2025-07-12 15:53:26,687 - root - INFO - Number of samples: 55, acc: 0.8545, balanced acc: 0.8603, loss: 2.4869. 
2025-07-12 15:53:26,687 - root - INFO - Saving predictions to /fs/scratch/PAS2099/mino/ICICLE/log_auto/pipeline/serengeti_serengeti_C03/upper_bound/2025-07-12-15-52-51/bioclip2/full_text_head/2025-07-12-15-52-55/log. 
2025-07-12 15:53:26,688 - root - INFO - Training on checkpoint ckp_20. 
2025-07-12 15:53:26,688 - root - INFO - Gathering samples from checkpoints: ['ckp_19']
2025-07-12 15:53:26,693 - root - INFO - Subset length: 217
2025-07-12 15:53:26,694 - root - INFO - Gathering samples from checkpoints: ['ckp_20']
2025-07-12 15:53:26,694 - root - INFO - Subset length: 31
2025-07-12 15:53:26,695 - root - INFO - Training dataset size: 217. 
2025-07-12 15:53:26,695 - root - INFO - Evaluation dataset size: 31. 
2025-07-12 15:53:26,695 - root - INFO - OOD mask: 0 / 217. 
2025-07-12 15:53:26,695 - root - INFO - AL mask: 0 / 217. 
2025-07-12 15:53:26,695 - root - INFO - Evaluating on current checkpoint ckp_19. 
2025-07-12 15:53:26,695 - root - INFO - Gathering samples from checkpoints: ['ckp_19']
2025-07-12 15:53:26,696 - root - INFO - Subset length: 55
2025-07-12 15:53:27,387 - root - INFO - Eval on current training checkpoint ckp_19: Number of samples: 55, acc: 0.8545, balanced acc: 0.8603, loss: 2.4869. 
2025-07-12 15:53:27,388 - root - INFO - Evaluating on next checkpoint ckp_20. 
2025-07-12 15:53:28,063 - root - INFO - Number of samples: 31, acc: 0.9355, balanced acc: 0.9364, loss: 2.4600. 
2025-07-12 15:53:28,063 - root - INFO - Saving predictions to /fs/scratch/PAS2099/mino/ICICLE/log_auto/pipeline/serengeti_serengeti_C03/upper_bound/2025-07-12-15-52-51/bioclip2/full_text_head/2025-07-12-15-52-55/log. 
wandb:                                                                                
wandb: 
wandb: Run history:
wandb:          accuracy ▄▆▃▇▇▆▇█▄▅▁▇▆▅▄▆█▆▅█
wandb: balanced_accuracy ▄▆▃▇▇▆▇█▄▅▁▇▆▅▄▆█▆▆█
wandb: 
wandb: Run summary:
wandb:          accuracy 0.93548
wandb: balanced_accuracy 0.93636
wandb: 
wandb: 🚀 View run serengeti_serengeti_C03 | upper_bound | 2025-07-12-15-52-51 | bioclip2 | full_text_head | 2025-07-12-15-52-55 at: https://wandb.ai/minodaze-the-ohio-state-university/ICICLE-Benchmark/runs/d3y96bgv
wandb: ⭐️ View project at: https://wandb.ai/minodaze-the-ohio-state-university/ICICLE-Benchmark
wandb: Synced 5 W&B file(s), 0 media file(s), 0 artifact file(s) and 0 other file(s)
wandb: Find logs at: ./wandb/run-20250712_155255-d3y96bgv/logs
2025-07-12 15:53:28,602 - root - INFO - Elapsed time: 32.89 seconds. 
